ProductNo,ProductName
22485,Set Of 2 Wooden Market Crates
22596,Christmas Star Wish List Chalkboard
23235,Storage Tin Vintage Leaf
23272,Tree T-Light Holder Willie Winkie
23239,Set Of 4 Knick Knack Tins Poppies
21705,Bag 500g Swirly Marbles
22118,Joy Wooden Block Letters
22119,Peace Wooden Block Letters
22217,T-Light Holder Hanging Lace
22216,T-Light Holder White Lace
22380,Toy Tidy Spaceboy
22442,Grow Your Own Flowers Set Of 3
22664,Toy Tidy Dolly Girl Design
22721,Set Of 3 Cake Tins Sketchbook
22723,Set Of 6 Herb Tins Sketchbook
22785,Squarecushion Cover Pink Union Jack
22955,36 Foil Star Cake Cases
23141,Triple Wire Hook Pink Heart
22956,36 Foil Heart Cake Cases
22581,Wood Stocking Christmas Scandispot
23198,Pantry Magnetic Shopping List
23197,Sketchbook Magnetic Shopping List
23184,Bull Dog Bottle Opener
23168,Classic Cafe Sugar Dispenser
23167,Small Ceramic Top Storage Jar
23166,Medium Ceramic Top Storage Jar
23165,Large Ceramic Top Storage Jar
23004,Travel Card Wallet Pantry
23002,Travel Card Wallet Skulls
23000,Travel Card Wallet Transport
22998,Travel Card Wallet Keep Calm
22994,Travel Card Wallet Retrospot
22835,Hot Water Bottle I Am So Poorly
22730,Alarm Clock Bakelike Ivory
22728,Alarm Clock Bakelike Pink
22727,Alarm Clock Bakelike Red
22726,Alarm Clock Bakelike Green
22720,Set Of 3 Cake Tins Pantry Design
22693,Grow A Flytrap Or Sunflower In Tin
22670,French Wc Sign Blue Metal
22667,Recipe Box Retrospot
22666,Recipe Box Pantry Yellow Design
22631,Circus Parade Lunch Box
22628,Picnic Boxes Set Of 3 Retrospot
22467,Gumball Coat Rack
22197,Popcorn Holder
22114,Hot Water Bottle Tea And Sympathy
22112,Chocolate Hot Water Bottle
21908,Chocolate This Way Metal Sign
21874,Gin And Tonic Mug
21872,Glamorous Mug
21871,Save The Planet Mug
21533,Retrospot Large Milk Jug
21481,Fawn Blue Hot Water Bottle
21479,White Skull Hot Water Bottle
21248,Door Hanger Mum + Dads Room
21216,Set 3 Retrospot Tea/Coffee/Sugar
21181,Please One Person Metal Sign
21175,Gin And Tonic Diet Metal Sign
21169,You're Confusing Me Metal Sign
21162,Toxic Area Door Hanger
21159,Moody Boy Door Hanger
21158,Moody Girl Door Hanger
21154,Red Retrospot Oven Glove
16016,Large Chinese Style Scissor
16014,Small Chinese Style Scissor
16008,Small Folding Scissor(Pointed Edge)
85152,Hand Over The Chocolate Sign
84596F,Small Marshmallows Pink Bowl
84596B,Small Dolly Mix Design Orange Bowl
84510A,Set Of 4 English Rose Coasters
82600,N0 Singing Metal Sign
82581,Toilet Metal Sign
72232,Feng Shui Pillar Candle
47559B,Tea Time Oven Glove
47504H,English Rose Spirit Level
23493,Vintage Doily Travel Sewing Kit
23430,Blue Retro Kitchen Wall Clock
23429,Red Retro Kitchen Wall Clock
23428,Ivory Retro Kitchen Wall Clock
23358,Hot Stuff Hot Water Bottle
23293,Set Of 12 Fairy Cake Baking Cases
23243,Set Of Tea Coffee Sugar Tins Pantry
23240,Set Of 4 Knick Knack Tins Doily
48111,Doormat 3 Smiley Cats
22464,Hanging Metal Heart Lantern
20982,12 Pencils Tall Tube Skulls
20981,12 Pencils Tall Tube Woodland
23424,Gingham Recipe Book Box
23338,Egg Frying Pan Red
84970L,Single Heart Zinc T-Light Holder
22457,Natural Slate Heart Chalkboard
22469,Heart Of Wicker Small
22909,Set Of 20 Vintage Christmas Napkins
84947,Antique Silver Tea Glass Engraved
23503,Playing Cards Keep Calm & Carry On
23445,Ice Cream Bubbles
23530,Wall Art Only One Person
84997C,Childrens Cutlery Polkadot Blue
84997D,Childrens Cutlery Polkadot Pink
84077,World War 2 Gliders Asstd Designs
22749,Feltcraft Princess Charlotte Doll
23127,Feltcraft Girl Nicole Kit
23126,Feltcraft Girl Amelie Kit
22747,Poppy's Playhouse Bathroom
22078,Ribbon Reel Lace Design
84946,Antique Silver T-Light Glass
22791,T-Light Glass Fluted Antique
21326,Aged Glass Silver T-Light Holder
22170,Picture Frame Wood Triple Portrait
23082,Set 6 Paper Table Lantern Hearts
22087,Paper Bunting White Lace
23464,Vintage Zinc Watering Can Small
22411,Jumbo Shopper Vintage Red Paisley
84029E,Red Woolly Hottie White Heart
22633,Hand Warmer Union Jack
23355,Hot Water Bottle Keep Calm
84029G,Knitted Union Flag Hot Water Bottle
84347,Rotating Silver Angels T-Light Hldr
21115,Rose Caravan Doorstop
22059,Ceramic Strawberry Design Mug
22072,Red Retrospot Tea Cup And Saucer
22123,Ping Microwave Apron
22476,Empire Union Jack Tv Dinner Tray
22495,Set Of 2 Round Tins Camembert
22496,Set Of 2 Round Tins Dutch Cheese
22513,Doorstop Football Design
22500,Set Of 2 Tins Jardin De Provence
23178,Jam Clock Magnet
23302,Kneeling Mat Housework Design
23533,Wall Art Garden Haven
84819,Danish Rose Round Sewing Box
22371,Airline Bag Vintage Tokyo 78
21875,Kings Choice Mug
23251,Vintage Red Enamel Trim Mug
23300,Gardeners Kneeling Pad Cup Of Tea
22138,Baking Set 9 Piece Retrospot
23843,Paper Craft Little Birdie
22617,Baking Set Spaceboy Design
20749,Assorted Colour Mini Cases
22910,Paper Chain Kit Vintage Christmas
22086,Paper Chain Kit 50'S Christmas
23351,Roll Wrap 50'S Christmas
23352,Roll Wrap 50'S Red Christmas
22491,Pack Of 12 Coloured Pencils
22561,Wooden School Colouring Set
22489,Pack Of 12 Traditional Crayons
22560,Traditional Modelling Clay
22139,Retrospot Tea Set Ceramic 11 Pc
23344,Jumbo Bag 50'S Christmas
23203,Jumbo Bag Vintage Doily
85099B,Jumbo Bag Red Retrospot
23201,Jumbo Bag Alphabet
23207,Lunch Bag Alphabet Design
21137,Black Record Cover Frame
23118,Parisienne Jewellery Drawer
23111,Parisienne Sewing Box
22179,Set 10 Night Owl Lights
22061,Large Cake Stand Hanging Strawbery
22182,Cake Stand Victorian Filigree Small
23571,Traditional Naughts & Crosses
23369,Set 36 Colour Pencils Love London
23370,Set 36 Colouring Pencils Doily
23371,Set 36 Colour Pencils Spaceboy
23372,Set 36 Colour Pencils Dolly Girl
23376,Pack Of 12 Vintage Christmas Tissue
23377,Pack Of 12 Dolly Girl Tissues
23378,Pack Of 12 50'S Christmas Tissues
23379,Pack Of 12 Red Apple Tissues
23380,Pack Of 12 Vintage Doily Tissues
23381,Pack Of 12 Vintage Leaf Tissues
23382,Box Of 6 Christmas Cake Decorations
23391,I Love London Mini Backpack
23392,Spaceboy Rocket Lolly Makers
23399,Home Sweet Home Hanging Heart
23405,Home Sweet Home 2 Drawer Cabinet
23418,Lavender Toilette Bottle
23426,Metal Sign Drop Your Pants
23434,3 Raffia Ribbons 50'S Christmas
23435,3 Raffia Ribbons Vintage Christmas
23439,Hand Warmer Red Love Heart
23451,Square Mini Portrait Frame
23467,Vintage Zinc Planter
23469,Card Holder Love Bird Small
23480,Mini Lights Woodland Mushrooms
23494,Vintage Doily Deluxe Sewing Kit
23495,Set Of 3 Pantry Wooden Spoons
23497,Classic Chrome Bicycle Bell
23498,Classic Bicycle Clips
23501,Key Ring Baseball Boot Union Jack
23506,Mini Playing Cards Spaceboy
23508,Mini Playing Cards Dolly Girl
23510,Mini Playing Cards Gymkhana
23521,Wall Art Cat And Bird
23526,Wall Art Dog Licence
23534,Wall Art Stop For Tea
23535,Wall Art Bicycle Safety
23536,Wall Art Village Show
23538,Wall Art Vintage Heart
23551,Pack Of 12 Paisley Park Tissues
23552,Bicycle Puncture Repair Kit
23555,Landmark Frame Notting Hill
23559,Woodland Bunnies Lolly Makers
23561,Set Of 6 Ribbons Party
23564,Egg Cup Milkmaid Ingrid
23565,Egg Cup Milkmaid Helga
23567,Egg Cup Henrietta Hen Pink
23569,Tradtional Alphabet Stamp Set
23570,Traditional Pick Up Sticks Game
23575,Snack Tray Paisley Park
23579,Snack Tray I Love London
23611,Set 10 Cards Red Riding Hood 17214
23616,Set 10 Cards Jingle Bells 17217
23621,Set 10 Cards David's Madonna 17074
23635,Set 10 Cards Christmas Holly 17259
23644,Set 10 Cards Christmas Tree 16955
23660,Henrietta Hen Mug
23661,Milk Maids Mug
35095A,Blue Victorian Fabric Oval Box
35095B,Red Victorian Fabric Oval Box
35646,Vintage Bead Pink Evening Bag
35648,Vintage Bead Pink Purse
35953,Folkart Star Christmas Decorations
35964,Folkart Clip On Stars
35970,Zinc Folkart Sleigh Bells
46118,Funky Monkey Cushion Cover
46776A,Woven Bubble Gum Cushion Cover
46776B,Woven Berries Cushion Cover
46776C,Woven Frost Cushion Cover
46776D,Woven Sunset Cushion Cover
46776E,Woven Candy Cushion Cover
46776F,Woven Rose Garden Cushion Cover
47310M,Small Pop Box Funky Monkey
47480,Hanging Photo Clip Rope Ladder
47563A,Retro Longboard Ironing Board Cover
47566,Party Bunting
47590B,Pink Happy Birthday Bunting
51014A,Feather Pen Hot Pink
51014L,Feather Pen Light Pink
71270,Photo Clip Line
72349B,Set/6 Purple Butterfly T-Lights
72741,Grand Chocolatecandle
72800E,4 Ivory Dinner Candles Silver Flock
79321,Chilli Lights
82484,Wood Black Board Ant White Finish
82567,Airline Lounge Metal Sign
82582,Area Patrolled Metal Sign
84031A,Charlie+Lola Red Hot Water Bottle
84249A,Greeting Card Square Doughnuts
84375,Set Of 20 Kids Cookie Cutters
84378,Set Of 3 Heart Cookie Cutters
84519B,Carrot Charlie+Lola Coaster Set
84559A,3d Sheet Of Dog Stickers
84568,Girls Alphabet Iron On Patches
84569D,Pack 6 Heart/Ice-Cream Patches
84598,Boys Alphabet Iron On Patches
84692,Box Of 24 Cocktail Parasols
84755,Colour Glass T-Light Holder Hanging
84828,Jungle Popsicles Ice Lolly Moulds
84879,Assorted Colour Bird Ornament
84923,Pink Butterfly Handbag W Bobbles
84970S,Hanging Heart Zinc T-Light Holder
84978,Hanging Heart Jar T-Light Holder
84991,60 Teatime Fairy Cake Cases
84997A,Childrens Cutlery Polkadot Green
84997B,Childrens Cutlery Retrospot Red
20733,Gold Mini Tape Measure
20777,Chrysanthemum Notebook
20782,Camouflage Ear Muff Headphones
20914,Set/5 Red Retrospot Lid Glass Bowls
20931,Blue Pot Plant Candle
20970,Pink Floral Feltcraft Shoulder Bag
20971,Pink Blue Felt Craft Trinket Box
20972,Pink Cream Felt Craft Trinket Box
20973,12 Pencil Small Tube Woodland
20978,36 Pencils Tube Skulls
20979,36 Pencils Tube Red Retrospot
20983,12 Pencils Tall Tube Red Retrospot
20985,Heart Calculator
20986,Blue Calculator Ruler
21000,Rose Du Sud Cosmetics Bag
21012,Antique All Glass Candlestick
21015,Dark Bird House Tree Decoration
21026,Space Owl
21035,Set/2 Red Retrospot Tea Towels
21064,Boom Box Speaker Boys
21065,Boom Box Speaker Girls
21098,Christmas Toilet Roll
21123,Set/10 Ivory Polkadot Party Candles
21125,Set 6 Football Celebration Candles
21126,Set Of 6 Girls Celebration Candles
21166,Cook With Wine Metal Sign
21172,Party Metal Sign
21174,Pottering In The Shed Metal Sign
21200,Multicolour Honeycomb Paper Garland
21201,Tropical Honeycomb Paper Garland
21212,Pack Of 72 Retrospot Cake Cases
21213,Pack Of 72 Skull Cake Cases
21220,Set/4 Badges Dogs
21224,Set/4 Skull Badges
21232,Strawberry Ceramic Trinket Pot
21257,Victorian Sewing Box Medium
21258,Victorian Sewing Box Large
21259,Victorian Sewing Box Small
21313,Glass Heart T-Light Holder
21314,Small Glass Heart Trinket Pot
21328,Balloons Writing Set
21329,Dinosaurs Writing Set
21356,Toast Its - Fairy Flower
21378,Small Tall Camphor Wood Toadstool
21379,Camphor Wood Portobello Mushroom
21383,Pack Of 12 Sticky Bunnies
21402,Red Egg Spoon
21408,Spotty Pink Duck Doorstop
21411,Gingham Heart Doorstop Red
21467,Cherry Crochet Food Cover
21471,Strawberry Raffia Food Cover
21484,Chick Grey Hot Water Bottle
21485,Retrospot Heart Hot Water Bottle
21494,Rotating Leaves T-Light Holder
21506,Fancy Font Birthday Card
21507,Elephant Birthday Card
21508,Vintage Kid Dolly Card
21509,Cowboys And Indians Birthday Card
21528,Dairy Maid Traditional Teapot
21544,Skulls Water Transfer Tattoos
21558,Skull Lunch Box With Cutlery
21559,Strawberry Lunch Box With Cutlery
21615,4 Lavender Botanical Dinner Candles
21616,4 Pear Botanical Dinner Candles
21620,Set Of 4 Rose Botanical Candles
21642,Assorted Tutti Frutti Pen
21648,Assorted Tutti Frutti Small Purse
21650,Assorted Tutti Frutti Bracelet
21675,Butterflies Stickers
21677,Hearts Stickers
21678,Paisley Pattern Stickers
21680,Woodland Stickers
21703,Bag 125g Swirly Marbles
21704,Bag 250g Swirly Marbles
21716,Boys Vintage Tin Seaside Bucket
21718,Red Metal Beach Spade
21724,Panda And Bunnies Sticker Sheet
21731,Red Toadstool Led Night Light
21739,Cosy Slipper Shoes Small Green
21774,Decorative Cats Bathroom Bottle
21786,Polkadot Rain Hat
21787,Rain Poncho Retrospot
21790,Vintage Snap Cards
21791,Vintage Heads And Tails Card Game
21808,Christmas Garland Stars Trees
21810,Christmas Hanging Star With Bell
21812,Garland With Hearts And Bells
21813,Garland With Stars And Bells
21822,Glitter Christmas Tree With Bells
21828,Eight Piece Snake Set
21832,Chocolate Calculator
21833,Camouflage Led Torch
21876,Pottering Mug
21879,Hearts Gift Tape
21889,Wooden Box Of Dominoes
21890,S/6 Wooden Skittles In Cotton Bag
21892,Traditional Wooden Catch Cup Game
21900,Key Fob Shed
21901,Key Fob Back Door
21902,Key Fob Front Door
21905,More Butter Metal Sign
21906,Pharmacie First Aid Tin
21914,Blue Harmonica In Box
21916,Set 12 Retro White Chalk Sticks
21930,Jumbo Storage Bag Skulls
21931,Jumbo Storage Bag Suki
21932,Scandinavian Paisley Picnic Bag
21934,Skull Shoulder Bag
21935,Suki Shoulder Bag
21936,Red Retrospot Picnic Bag
21942,Skulls Design Flannel
21945,Strawberries Design Flannel
21947,Set Of 6 Heart Chopsticks
21949,Set Of 6 Strawberry Chopsticks
21967,Pack Of 12 Skull Tissues
21976,Pack Of 60 Mushroom Cake Cases
21977,Pack Of 60 Pink Paisley Cake Cases
21980,Pack Of 12 Red Retrospot Tissues
21981,Pack Of 12 Woodland Tissues
21982,Pack Of 12 Suki Tissues
21983,Pack Of 12 Blue Paisley Tissues
21984,Pack Of 12 Pink Paisley Tissues
21986,Pack Of 12 Pink Polkadot Tissues
21989,Pack Of 20 Skull Paper Napkins
21990,Modern Floral Stationery Set
21993,Floral Folk Stationery Set
22024,Rainy Ladies Birthday Card
22025,Ring Of Roses Birthday Card
22026,Banquet Birthday Card
22027,Tea Party Birthday Card
22028,Penny Farthing Birthday Card
22029,Spaceboy Birthday Card
22031,Botanical Lavender Birthday Card
22037,Robot Birthday Card
22064,Pink Doughnut Trinket Pot
22065,Christmas Pudding Trinket Pot
22068,Black Pirate Treasure Chest
22070,Small Red Retrospot Mug In Box
22071,Small White Retrospot Mug In Box
22074,6 Ribbons Shimmering Pinks
22075,6 Ribbons Elegant Christmas
22076,6 Ribbons Empire
22083,Paper Chain Kit Retrospot
22085,Paper Chain Kit Skulls
22091,Empire Tissue Box
22099,Caravan Square Tissue Box
22104,Mirror Mosaic Candle Plate
22106,Mirror Mosaic Hurricane Lamp
22107,Pizza Plate In Box
22108,Ping! Microwave Plate
22109,Full English Breakfast Plate
22110,Bird House Hot Water Bottle
22111,Scottie Dog Hot Water Bottle
22116,Metal Sign His Dinner Is Served
22121,Noel Wooden Block Letters
22124,Set Of 2 Tea Towels Ping Microwave
22129,Party Cones Candy Decoration
22134,Mini Ladle Love Heart Red
15036,Assorted Colours Silk Fan
15039,Sandalwood Fan
15058C,Ice Cream Design Garden Parasol
16218,Cartoon Pencil Sharpeners
16225,Rattle Snake Eggs
16235,Recycled Pencil With Rabbit Eraser
16237,Sleeping Cat Erasers
17038,Porcelain Budah Incense Holder
17084N,Fairy Dreams Incense
20659,Economy Luggage Tag
20665,Red Retrospot Purse
20668,Disco Ball Christmas Decoration
20718,Red Retrospot Shopper Bag
20719,Woodland Charlotte Bag
20723,Strawberry Charlotte Bag
20724,Red Retrospot Charlotte Bag
22135,Mini Ladle Love Heart Pink
22141,Christmas Craft Tree Top Angel
22150,3 Stripey Mice Feltcraft
22153,Angel Decoration Stars On Dress
22154,Angel Decoration 3 Buttons
22155,Star Decoration Rustic
22156,Heart Decoration With Pearls
22163,Heart String Memo Holder Hanging
22165,Diamante Heart Shaped Wall Mirror
22167,Oval Wall Mirror Diamante
22173,Metal 4 Hook Hanger French Chateau
22174,Photo Cube
22178,Victorian Glass Hanging T-Light
22186,Red Star Card Holder
22190,Local Cafe Mug
22193,Red Diner Wall Clock
22195,Large Heart Measuring Spoons
22196,Small Heart Measuring Spoons
22199,Frying Pan Red Retrospot
22209,Wood Stamp Set Happy Birthday
22212,Four Hook White Lovebirds
22219,Lovebird Hanging Decoration White
22224,White Lovebird Lantern
22227,Hanging Heart Mirror Decoration
22260,Felt Egg Cosy Blue Rabbit
22261,Felt Egg Cosy White Rabbit
22264,Felt Farm Animal White Bunny
22273,Feltcraft Doll Molly
22277,Cosmetic Bag Vintage Rose Paisley
22279,Pocket Bag Blue Paisley Red Spot
22280,Pocket Bag Pink Paisely Brown Spot
22300,Coffee Mug Dog + Ball Design
22301,Coffee Mug Cat + Bird Design
22307,Gold Mug Bone China Tree Of Life
22308,Tea Cosy Blue Stripe
22309,Tea Cosy Red Stripe
22324,Blue Polkadot Kids Bag
22326,Round Snack Boxes Set Of4 Woodland
22327,Round Snack Boxes Set Of 4 Skulls
22329,Round Container Set Of 5 Retrospot
22338,Star Decoration Painted Zinc
22340,Noel Garland Painted Zinc
22342,Home Garland Painted Zinc
22348,Tea Bag Plate Red Retrospot
22355,Charlotte Bag Suki Design
22356,Charlotte Bag Pink Polkadot
22357,Kings Choice Biscuit Tin
22358,Kings Choice Tea Caddy
22361,Glass Jar Daisy Fresh Cotton Wool
22362,Glass Jar Peacock Bath Salts
22367,Childrens Apron Spaceboy Design
22372,Airline Bag Vintage World Champion
22374,Airline Bag Vintage Jet Set Red
85014B,Red Retrospot Umbrella
85032C,Curious Images Gift Wrap Set
85038,6 Chocolate Love Heart T-Lights
85039A,Set/4 Red Mini Rose Candle In Bowl
85039B,S/4 Ivory Mini Rose Candle In Bowl
85040A,S/4 Pink Flower Candles In Bowl
85048,15cm Christmas Glass Ball 20 Lights
85049C,Romantic Pinks Ribbons
85049G,Chocolate Box Ribbons
85049H,Urban Black Ribbons
85053,French Enamel Candleholder
85059,French Enamel Water Basin
85066,Cream Sweetheart Mini Chest
85094,Candy Spot Egg Warmer Rabbit
85114C,Red Enchanted Forest Placemat
85123A,Cream Hanging Heart T-Light Holder
85131B,Beaded Crystal Heart Green On Stick
85131D,Beaded Crystal Heart Pink On Stick
85168B,Black Baroque Carriage Clock
85169C,Eau De Nil Love Bird Candle
85170C,Set/6 Eau De Nil Bird T-Lights
85173,Set/6 Frog Prince T-Light Candles
85177,Basket Of Flowers Sewing Kit
85178,Victorian Sewing Kit
85179A,Green Bitty Light Chain
85199S,Small Hanging Ivory/Red Wood Bird
85227,Set Of 6 3d Kit Cards For Kids
90003C,Midnight Blue Pair Heart Hair Slide
90003E,Green Pair Heart Hair Slides
90010A,Midnight Blue Glass/Silver Bracelet
90013A,Midnight Blue Vintage Earrings
90013C,Green Vintage Earrings
90014A,Silver Mop Orbit Necklace
90016B,Gold/Mop Pendant Orbit Necklace
90018B,Gold Mop Orbit Drop Earrings
90019B,Gold Mop Orbit Bracelet
90027D,Glass Bead Hoop Earrings Amethyst
90030B,Red Kukui Coconut Seed Necklace
90055,Cracked Glaze Earrings Brown
90059A,Diamante Hair Grip Pack/2 Crystal
90059D,Diamante Hair Grip Pack/2 Peridot
90059E,Diamante Hair Grip Pack/2 Ruby
90059F,Diamante Hair Grip Pack/2 Lt Rose
90072,Ruby Drop Chandelier Earrings
90086,Crystal Frog Phone Charm
90120B,Blue Murano Twist Bracelet
90120C,Green Murano Twist Bracelet
90130B,Turq Stone/Crystal Earrings
90130C,Green Stone/Crystal Earrings
90134,Old Rose Combo Bead Necklace
90138,White/Pink Mini Crystals Necklace
90141B,Ivory Pendant Triple Shell Necklace
90145,Silver Hoop Earrings With Flower
90155,Resin Necklace W Pastel Beads
90161D,Ant Copper Pink Boudicca Bracelet
90163A,Pink Rosebud & Pearl Necklace
90165B,White Rosebud Pearl Earrings
90168,2 Daisies Hair Comb
90169,Daisy Hair Comb
90170,Daisy Hair Band
90174,Butterfly Hair Band
90175A,White Glass Chunky Charm Bracelet
90175D,Tigris Eye Chunky Charm Bracelet
90177A,Classic Diamante Earrings Jet
90177C,Drop Diamante Earrings Crystal
90181B,Amethyst Glass/Shell/Pearl Necklace
90182C,Black 3 Bead Drop Earrings
90183A,Amber Drop Earrings W Long Beads
90183C,Black Drop Earrings W Long Beads
90184C,Black Chunky Bead Bracelet W Strap
90185B,Amethyst Diamante Expandable Ring
90188,Drop Earrings W Flower & Leaf
90191,Silver Lariat 40cm
90192,Jade Drop Earrings W Filigree
90198A,Vintage Rose Bead Bracelet Raspberr
90200A,Purple Sweetheart Bracelet
90201A,Purple Enamel Flower Ring
90201B,Black Enamel Flower Ring
90201C,Red Enamel Flower Ring
90201D,Green Enamel Flower Ring
90202C,Green Enamel Flower Hair Tie
90202D,Pink Enamel Flower Hair Tie
90206C,Crystal Diamante Star Brooch
90208,Pair Of Pink Flower Cluster Slide
90210A,Grey Acrylic Faceted Bangle
22378,Wall Tidy Retrospot
22379,Recycling Bag Retrospot
22396,Magnets Pack Of 4 Retro Photo
22418,10 Colour Spaceboy Pen
22419,Lipstick Pen Red
22420,Lipstick Pen Baby Pink
22421,Lipstick Pen Fuschia
22422,Toothpaste Tube Pen
22437,Set Of 9 Black Skull Balloons
22441,Grow Your Own Basil In Enamel Mug
22446,Pin Cushion Babushka Pink
22466,Fairy Tale Cottage Night Light
22478,Birdhouse Garden Marker
22486,Plasmatronic Lamp
22488,Natural Slate Rectangle Chalkboard
22540,Mini Jigsaw Circus Parade
22544,Mini Jigsaw Spaceboy
22549,Picture Dominoes
22551,Plasters In Tin Spaceboy
22553,Plasters In Tin Skulls
22554,Plasters In Tin Woodland Animals
22555,Plasters In Tin Strongman
22557,Plasters In Tin Vintage Paisley
22558,Clothes Pegs Retrospot Pack 24
22565,Feltcraft Hairbands Pink And White
22566,Feltcraft Hairband Pink And Purple
22571,Rocking Horse Red Christmas
22573,Star Wooden Christmas Decoration
22574,Heart Wooden Christmas Decoration
22576,Swallow Wooden Christmas Decoration
22577,Wooden Heart Christmas Scandinavian
22578,Wooden Star Christmas Scandinavian
22580,Advent Calendar Gingham Sack
22585,Pack Of 6 Birdy Gift Tags
22586,Feltcraft Hairband Pink And Blue
22589,Cardholder Gingham Star
22591,Cardholder Gingham Christmas Tree
22592,Cardholder Holly Wreath Metal
22593,Christmas Gingham Star
22594,Christmas Gingham Tree
22597,Musical Zinc Heart Decoration
22598,Christmas Musical Zinc Tree
22599,Christmas Musical Zinc Star
22600,Christmas Retrospot Star Wood
22601,Christmas Retrospot Angel Wood
22602,Retrospot Wooden Heart Decoration
22608,Pens Assorted Funky Jeweled
22614,Pack Of 12 Spaceboy Tissues
22615,Pack Of 12 Circus Parade Tissues
22616,Pack Of 12 London Tissues
22619,Set Of 6 Soldier Skittles
22620,4 Traditional Spinning Tops
22621,Traditional Knitting Nancy
22629,Spaceboy Lunch Box
22630,Dolly Girl Lunch Box
22632,Hand Warmer Red Retrospot
22634,Childs Breakfast Set Spaceboy
22650,Ceramic Pirate Chest Money Bank
22651,Gentleman Shirt Repair Kit
22653,Button Box
22654,Deluxe Sewing Kit
22659,Lunch Box I Love London
22694,Wicker Star
22697,Green Regency Teacup And Saucer
22699,Roses Regency Teacup And Saucer
22701,Pink Dog Bowl
22703,Pink Cat Bowl
22712,Card Dolly Girl
22713,Card I Love London
22714,Card Birthday Cowboy
22716,Card Circus Parade
22717,Card Dog And Ball
22725,Alarm Clock Bakelike Chocolate
22741,Funky Diva Pen
22745,Poppy's Playhouse Bedroom
22748,Poppy's Playhouse Kitchen
22751,Feltcraft Princess Olivia Doll
22753,Small Yellow Babushka Notebook
22754,Small Red Babushka Notebook
22757,Large Red Babushka Notebook
22758,Large Purple Babushka Notebook
22763,Key Cabinet Ma Campagne
22768,Family Photo Frame Cornice
22776,Sweetheart 3 Tier Cake Stand
22795,Sweetheart Recipe Book Stand
22798,Antique Glass Dressing Table Pot
22800,Antique Tall Swirlglass Trinket Pot
22809,Set Of 6 T-Lights Santa
22811,Set Of 6 T-Lights Cacti
22814,Card Party Games
22815,Card Psychedelic Apples
22816,Card Motorbike Santa
22817,Card Suki Birthday
22818,Card Christmas Village
22819,Birthday Card Retro Spot
22865,Hand Warmer Owl Design
22866,Hand Warmer Scotty Dog Design
22867,Hand Warmer Bird Design
22881,Number Tile Vintage Font 2
22885,Number Tile Vintage Font 6
22888,Number Tile Vintage Font 9
22890,Novelty Biscuits Cake Stand 3 Tier
22898,Childrens Apron Apples Design
22899,Children's Apron Dolly Girl
22900,Set 2 Tea Towels I Love London
22905,Calendar In Season Design
22907,Pack Of 20 Napkins Pantry Design
22914,Blue Coat Rack Paris Fashion
22922,Fridge Magnets Us Diner Assorted
22924,Fridge Magnets La Vie En Rose
22928,Yellow Giant Garden Thermometer
22940,Feltcraft Christmas Fairy
22941,Christmas Lights 10 Reindeer
22943,Christmas Lights 10 Vintage Baubles
22948,Metal Decoration Naughty Children
22951,60 Cake Cases Dolly Girl Design
22952,60 Cake Cases Vintage Christmas
22960,Jam Making Set With Jars
22961,Jam Making Set Printed
22962,Jam Jar With Pink Lid
22963,Jam Jar With Green Lid
22964,3 Piece Spaceboy Cookie Cutter Set
22965,3 Traditional Biscuit Cutters Set
22966,Gingerbread Man Cookie Cutter
22969,Homemade Jam Scented Candles
22975,Spaceboy Childrens Egg Cup
22976,Circus Parade Childrens Egg Cup
22977,Dolly Girl Childrens Egg Cup
22979,Pantry Washing Up Brush
22980,Pantry Scrubbing Brush
22982,Pantry Pastry Brush
22983,Card Billboard Font
22984,Card Gingham Rose
22988,Soldiers Egg Cup
22989,Set 2 Pantry Design Tea Towels
22992,Revolver Wooden Ruler
22993,Set Of 4 Pantry Jelly Moulds
22995,Travel Card Wallet Suki
22996,Travel Card Wallet Vintage Ticket
22997,Travel Card Wallet Union Jack
22999,Travel Card Wallet Vintage Leaf
23005,Travel Card Wallet I Love London
23007,Spaceboy Baby Gift Set
23009,I Love London Baby Gift Set
23012,Glass Apothecary Bottle Perfume
23013,Glass Apothecary Bottle Tonic
23014,Glass Apothecary Bottle Elixir
23050,Recycled Acapulco Mat Green
23051,Recycled Acapulco Mat Blue
23052,Recycled Acapulco Mat Turquoise
23053,Recycled Acapulco Mat Pink
23054,Recycled Acapulco Mat Lavender
23074,Embossed Heart Trinket Box
23076,Ice Cream Sundae Lip Gloss
23077,Doughnut Lip Gloss
23083,Set 6 Paper Table Lantern Stars
23084,Rabbit Night Light
23088,Zinc Heart Flower T-Light Holder
23089,Glass Bon Bon Jar
23093,Small Parisienne Heart Photo Frame
23103,Jingle Bell Heart Decoration
23110,Parisienne Key Cabinet
23112,Parisienne Curio Cabinet
23158,Set Of 5 Lucky Cat Magnets
23171,Regency Tea Plate Green
23172,Regency Tea Plate Pink
23173,Regency Teapot Roses
23175,Regency Milk Jug Pink
23177,Treasure Island Book Box
23183,Mother's Kitchen Spoon Rest
23188,Vintage 2 Metre Folding Ruler
23191,Bundle Of 3 Retro Note Books
23194,Gymkhana Treasure Book Box
23196,Vintage Leaf Magnetic Notepad
23204,Charlotte Bag Apples Design
23205,Charlotte Bag Vintage Alphabet
23212,Heart Wreath Decoration With Bell
23213,Star Wreath Decoration With Bell
23220,Reindeer Heart Decoration Gold
23224,Cherub Heart Decoration Gold
23229,Vintage Donkey Tail Game
23234,Biscuit Tin Vintage Christmas
23241,Treasure Tin Gymkhana Design
23245,Set Of 3 Regency Cake Tins
23247,Biscuit Tin 50'S Christmas
23264,Set Of 3 Wooden Sleigh Decorations
23265,Set Of 3 Wooden Tree Decorations
23266,Set Of 3 Wooden Stocking Decoration
