ProductNo,ProductName
23274,Star T-Light Holder Willie Winkie
23275,Set Of 3 Hanging Owls Ollie Beak
23280,Folding Butterfly Mirror Hot Pink
23284,Doormat Keep Calm And Come In
23285,Pink Vintage Spot Beaker
23287,Red Vintage Spot Beaker
23290,Spaceboy Childrens Bowl
23292,Spaceboy Childrens Cup
23294,Set Of 6 Snack Loaf Baking Cases
23295,Set Of 12 Mini Loaf Baking Cases
23298,Spotty Bunting
23299,Food Cover With Beads Set 2
23301,Gardeners Kneeling Pad Keep Calm
23307,Set Of 60 Pantry Design Cake Cases
23308,Set Of 60 Vintage Leaf Cake Cases
23309,Set Of 60 I Love London Cake Cases
23310,Bubblegum Ring Assorted
23311,Vintage Christmas Stocking
23312,Vintage Christmas Gift Sack
23313,Vintage Christmas Bunting
23314,Vintage Christmas Tablecloth
23319,Box Of 6 Mini 50'S Crackers
23322,Large White Heart Of Wicker
23323,White Wicker Star
23328,Set 6 School Milk Bottles In Crate
23332,Ivory Wicker Heart Large
23334,Ivory Wicker Heart Small
23336,Egg Frying Pan Pink
23340,Vintage Christmas Cake Frill
23345,Dolly Girl Beaker
23347,I Love London Beaker
23349,Roll Wrap Vintage Christmas
23353,6 Gift Tags Vintage Christmas
23354,6 Gift Tags 50'S Christmas
23357,Hot Water Bottle Sex Bomb
23365,Set 12 Colour Pencils Love London
23366,Set 12 Colouring Pencils Doily
23367,Set 12 Colour Pencils Spaceboy
23368,Set 12 Colour Pencils Dolly Girl
23581,Jumbo Bag Paisley Park
21928,Jumbo Bag Scandinavian Blue Paisley
21929,Jumbo Bag Pink Vintage Paisley
85099C,Jumbo Bag Baroque Black White
23199,Jumbo Bag Apples
23200,Jumbo Bag Pears
23202,Jumbo Bag Vintage Leaf
23343,Jumbo Bag Vintage Christmas
23583,Lunch Bag Paisley Park
20727,Lunch Bag Black Skull
20728,Lunch Bag Cars Blue
20725,Lunch Bag Red Retrospot
20726,Lunch Bag Woodland
22662,Lunch Bag Dolly Girl Design
23206,Lunch Bag Apple Design
23208,Lunch Bag Vintage Leaf Design
23375,50'S Christmas Paper Gift Bag
23437,50'S Christmas Gift Bag Large
22821,Gift Bag Psychedelic Apples
79190B,Retro Plastic Polka Tray
79190A,Retro Plastic 70'S Tray
22915,Assorted Bottle Top Magnets
22151,Place Setting White Heart
71459,Hanging Jam Jar T-Light Holders
84945,Multi Colour Silver T-Light Holder
21108,Fairy Cake Flannel Assorted Colour
22252,Birdcage Decoration Tealight Holder
22807,Set Of 6 T-Lights Toadstools
22556,Plasters In Tin Circus Parade
22328,Round Snack Boxes Set Of 4 Fruits
10125,Mini Funky Design Tapes
23388,Woodland Mini Backpack
23390,Dolly Girl Mini Backpack
23389,Spaceboy Mini Backpack
22698,Pink Regency Teacup And Saucer
15056N,Edwardian Parasol Natural
48138,Doormat Union Flag
21523,Doormat Fancy Font Home Sweet Home
21877,Home Sweet Home Mug
22423,Regency Cakestand 3 Tier
23598,Paper Bunting Vintage Party
16169E,Wrap 50'S Christmas
23350,Roll Wrap Vintage Spot
22314,Office Mug Warmer Choc+Blue
22313,Office Mug Warmer Pink
20831,Gold Photo Frame
21462,Nursery A B C Painted Letters
22215,Cake Stand White Two Tier Lace
22220,Cake Stand Lovebird 2 Tier White
22465,Hanging Metal Star Lantern
22539,Mini Jigsaw Dolly Girl
23438,Red Spot Gift Bag Large
21238,Red Retrospot Cup
21242,Red Retrospot Plate
21668,Red Stripe Ceramic Drawer Knob
21670,Blue Spot Ceramic Drawer Knob
21671,Red Spot Ceramic Drawer Knob
21672,White Spot Red Ceramic Drawer Knob
21673,White Spot Blue Ceramic Drawer Knob
21714,Citronella Candle Garden Pot
22735,Ribbon Reel Socks And Mittens
22736,Ribbon Reel Making Snowmen
22738,Ribbon Reel Snowy Village
22805,Blue Drawer Knob Acrylic Edwardian
22895,Set Of 2 Tea Towels Apple And Pears
22896,Peg Bag Apples Design
23356,Love Hot Water Bottle
82583,Hot Baths Metal Sign
22383,Lunch Bag Suki Design
20669,Red Heart Luggage Tag
20679,Edwardian Parasol Red
20717,Strawberry Shopper Bag
20750,Red Retrospot Mini Cases
20961,Strawberry Bath Sponge
20963,Apple Bath Sponge
21155,Red Retrospot Peg Bag
21217,Red Retrospot Round Cake Tins
21218,Red Spotty Biscuit Tin
21239,Pink Polkadot Cup
21327,Skulls Writing Set
21430,Set/3 Red Gingham Rose Storage Box
21557,Set Of 6 Funky Beakers
21754,Home Building Block Word
21843,Red Retrospot Cake Stand
21864,Union Jack Flag Passport Cover
21912,Vintage Snakes & Ladders
21955,Doormat Union Jack Guns And Roses
21987,Pack Of 6 Skull Paper Cups
22041,"Record Frame 7"" Single Size"
22069,Brown Pirate Treasure Chest
22077,6 Ribbons Rustic Charm
22142,Christmas Craft White Fairy
22144,Christmas Craft Little Friends
22161,Heart Decoration Rustic Hanging
22175,Pink Owl Soft Toy
22187,Green Christmas Tree Card Holder
22207,Frying Pan Union Flag
22278,Overnight Bag Vintage Rose Paisley
22302,Coffee Mug Pears Design
22303,Coffee Mug Apples Design
22304,Coffee Mug Blue Paisley Design
22352,Lunch Box With Cutlery Retrospot
22381,Toy Tidy Pink Polkadot
22424,Enamel Bread Bin Cream
22429,Enamel Measuring Jug Cream
22456,Natural Slate Chalkboard Large
22471,Tv Dinner Tray Air Hostess
22474,Spaceboy Tv Dinner Tray
22498,Wooden Regatta Bunting
22507,Memo Board Retrospot Design
22526,Wheelbarrow For Children
22622,Box Of Vintage Alphabet Blocks
22624,Ivory Kitchen Scales
22645,Ceramic Heart Fairy Cake Money Bank
22676,French Blue Metal Door Sign 1
22684,French Blue Metal Door Sign 9
22722,Set Of 6 Spice Tins Pantry Design
22733,3d Traditional Christmas Stickers
22734,Set Of 6 Ribbons Vintage Christmas
22813,Pack 3 Boxes Bird Panettone
22838,3 Tier Cake Tin Red And Cream
22844,Vintage Cream Dog Food Container
22845,Vintage Cream Cat Food Container
22891,Tea For One Polkadot
23080,Red Metal Box Top Secret
23170,Regency Tea Plate Roses
23181,Bull Dog Bottle Top Wall Clock
71053,White Moroccan Metal Lantern
82001S,Silver Record Cover Frame
82482,Wooden Picture Frame White Finish
82552,Washroom Metal Sign
21171,Bathroom Metal Sign
84032A,Charlie+Lola Pink Hot Water Bottle
84032B,Charlie + Lola Red Hot Water Bottle
84509A,Set Of 4 English Rose Placemats
84558A,3d Dog Picture Playing Cards
84832,Zinc Willie Winkie Candle Stick
84968E,Set Of 16 Vintage Black Cutlery
85049A,Traditional Christmas Ribbons
85049E,Scandinavian Reds Ribbons
85150,Ladies & Gentlemen Metal Sign
85174,S/4 Cacti Candles
20712,Jumbo Bag Woodland Animals
20713,Jumbo Bag Owls
22386,Jumbo Bag Pink Polkadot
22663,Jumbo Bag Dolly Girl Design
22384,Lunch Bag Pink Polkadot
82486,3 Drawer Antique White Wood Cabinet
48187,Doormat New England
22319,Hairclips Forties Fabric Assorted
20704,Mr Robot Soft Toy
21564,Pink Heart Shape Love Bucket
21563,Red Heart Shape Love Bucket
22299,Pig Keyring With Light & Sound
22447,Pin Cushion Babushka Blue
22695,Wicker Wreath Small
22942,Christmas Lights 10 Santas
22808,Set Of 6 T-Lights Easter Chicks
23143,Zinc Wire Kitchen Organiser
23151,Zinc Sweetheart Soap Dish
23425,Storage Tin Home Sweet Home
84356,Pompom Curtain
22545,Mini Jigsaw Bunnies
21209,Multicolour Honeycomb Fan
23270,Set Of 2 Ceramic Painted Hearts
23210,White Rocking Horse Hand Painted
22755,Small Purple Babushka Notebook
22200,Frying Pan Pink Polkadot
84031B,Charlie Lola Blue Hot Water Bottle
22646,Ceramic Strawberry Cake Money Bank
22644,Ceramic Cherry Cake Money Bank
22394,Paperweight Kings Choice
17091J,Vanilla Incense In Tin
35471D,Set Of 3 Bird Light Pink Feather
21109,Large Cake Towel Chocolate Spots
21111,Swiss Roll Towel Chocolate Spots
22185,Slate Tile Natural Hanging
22171,3 Hook Photo Shelf Antique White
23193,Buffalo Bill Treasure Book Box
20936,Forked Cactus Candle
23040,Paper Lantern 9 Point Snow Star
21222,Set/4 Badges Beetles
79066K,Retro Mod Tray
84380,Set Of 3 Butterfly Cookie Cutters
22095,Lads Only Tissue Box
85071C,"Charlie+Lola""Extremely Busy"" Sign"
23034,Drawer Knob Ceramic Black
21669,Blue Stripe Ceramic Drawer Knob
23033,Drawer Knob Ceramic Red
23318,Box Of 6 Mini Vintage Crackers
23527,Wall Art Animals And Nature
23524,Wall Art Horse & Pony
23525,Wall Art Buffalo Bill
23122,Party Charms 50 Pieces
84519A,Tomato Charlie+Lola Coaster Set
35004B,Set Of 3 Black Flying Ducks
21591,Cosy Hour Cigar Box Matches
23320,Giant 50'S Christmas Cracker
22985,Wrap Billboard Fonts Design
21194,Pink Honeycomb Paper Fan
21208,Pastel Colour Honeycomb Fan
79190D,Retro Plastic Daisy Tray
23537,Wall Art I Love London
22991,Giraffe Wooden Ruler
23190,Bundle Of 3 School Exercise Books
21355,Toast Its - I Love You
23404,Home Sweet Home Blackboard
21417,Cockle Shell Dish
84971S,Small Heart Flowers Hook
22627,Mint Kitchen Scales
22625,Red Kitchen Scales
22331,Woodland Party Bag + Sticker Set
22834,Hand Warmer Babushka Design
22505,Memo Board Cottage Design
23326,Hanging Mini Coloured Bottles
23317,Blue Refectory Clock
22794,Sweetheart Wire Magazine Rack
23182,Toilet Sign Occupied Or Vacant
21755,Love Building Block Word
44234,Assorted Circular Mobile
23238,Set Of 4 Knick Knack Tins London
23237,Set Of 4 Knick Knack Tins Leaf
21124,Set/10 Blue Polkadot Party Candles
21122,Set/10 Pink Polkadot Party Candles
21121,Set/10 Red Polkadot Party Candles
23255,Childrens Cutlery Circus Parade
21918,Set 12 Kids Colour Chalk Sticks
23037,Candle Holder Silver Madeline
23550,Wrap Alphabet Poster
22711,Wrap Circus Parade
21497,Fancy Fonts Birthday Wrap
22704,Wrap Red Apples
23515,Embroidered Ribbon Reel Daisy
22081,Ribbon Reel Flora + Fauna
22080,Ribbon Reel Polkadots
22908,Pack Of 20 Napkins Red Apples
23215,Jingle Bell Heart Antique Silver
23489,Vintage Bells Garland
84993A,75 Green Petit Four Cases
22906,12 Message Cards With Envelopes
21803,Christmas Tree Star Decoration
21809,Christmas Hanging Tree With Bell
20974,12 Pencils Small Tube Skull
22894,Tablecloth Red Apples Design
21351,Cinammon & Orange Wreath
22567,20 Dolly Pegs Retrospot
37500,Tea Time Teapot In Gift Box
23562,Set Of 6 Ribbons Perfectly Pretty
23681,Lunch Bag Red Vintage Doily
20832,Red Flock Love Heart Photo Frame
22481,Black Tea Towel Classic Design
22460,Embossed Glass Tealight Holder
22113,Grey Heart Hot Water Bottle
21684,Small Medina Stamped Metal Bowl
22398,Magnets Pack Of 4 Swallows
23145,Zinc T-Light Holder Star Large
20685,Doormat Red Retrospot
23256,Childrens Cutlery Spaceboy
22613,Pack Of 20 Spaceboy Napkins
23254,Childrens Cutlery Dolly Girl
72760B,Vintage Cream 3 Basket Cake Stand
23463,Vintage Zinc Watering Can
23144,Zinc T-Light Holder Stars Small
48194,Doormat Hearts
48185,Doormat Fairy Cake
23283,Doormat Vintage Leaf
48129,Doormat Topiary
22690,Doormat Home Sweet Home Blue
22057,Ceramic Plate Strawberry Design
22055,Mini Cake Stand Hanging Strawbery
22385,Jumbo Bag Spaceboy Design
23582,Vintage Doily Jumbo Bag Red
16219,House Shape Pencil Sharpener
16236,Kitty Pencil Erasers
16238,Party Time Pencil Erasers
17012D,Origami Rose Incense/Candle Set
17012F,Origami Sandlewood Incense/Cand Set
17084P,Dragons Blood Incense
18097C,White Tall Porcelain T-Light Holder
20682,Red Retrospot Childrens Umbrella
20764,Abstract Circles Sketchbook
20836,French Paisley Cushion Cover
20866,Blue Rose Fabric Mirror
21001,Rose Du Sud Washbag
21080,Set/20 Red Retrospot Paper Napkins
21094,Set/6 Red Spotty Paper Plates
21096,Set/6 Fruit Salad Paper Plates
21156,Retrospot Childrens Apron
21058,Party Invites Woodland
21167,White Sage Incense
21189,White Honeycomb Paper Garland
21215,Ivory Paper Cup Cake Cases
21219,Set/4 Badges Balloon Girl
21221,Set/4 Badges Cute Creatures
21231,Sweetheart Ceramic Trinket Box
21249,Woodland Height Chart Stickers
21284,Retrospot Candle Small
21288,Stripey Chocolate Nesting Boxes
21358,Toast Its - Happy Birthday
21390,Filigris Heart With Butterfly
21429,Red Gingham Rose Jewellery Box
21454,Painted Pink Rabbit
21470,Flower Vine Raffia Food Cover
21519,Gin & Tonic Diet Greeting Card
21580,Rabbit Design Cotton Tote Bag
21619,4 Vanilla Botanical Candles
21722,Sweet Pudding Sticker Sheet
21773,Decorative Rose Bathroom Bottle
21775,Decorative Flore Bathroom Bottle
21846,Pink Diamante Pen In Gift Box
21873,If You Can't Stand The Heat Mug
21891,Traditional Wooden Skipping Rope
21899,Garage Key Fob
21933,Pink Vintage Paisley Picnic Bag
21943,Cakes And Rabbits Design Flannel
21946,Party Time Design Flannel
21975,Pack Of 60 Dinosaur Cake Cases
21985,Pack Of 12 Hearts Design Tissues
21991,Bohemian Collage Stationery Set
22023,Empire Birthday Card
22090,Paper Bunting Retrospot
22105,Mirror Mosaic Goblet Candle Holder
22169,Family Album White Picture Frame
22188,Black Heart Card Holder
22208,Wood Stamp Set Thank You
22210,Wood Stamp Set Best Wishes
22211,Wood Stamp Set Flowers
22249,Decoration White Chick Magic Garden
22263,Felt Egg Cosy Ladybird
22274,Feltcraft Doll Emily
22294,Heart Filigree Dove Small
22296,Heart Ivory Trellis Large
22297,Heart Ivory Trellis Small
22312,Office Mug Warmer Polkadot
22315,200 Red + White Bendy Straws
22335,Heart Decoration Painted Zinc
22341,Love Garland Painted Zinc
22360,Glass Jar English Confectionery
22363,Glass Jar Marmalade
22364,Glass Jar Digestive Biscuits
22375,Airline Bag Vintage Jet Set Brown
22406,Money Box Kings Choice Design
22417,Pack Of 60 Spaceboy Cake Cases
22433,Watering Can Green Dinosaur
22477,Watering Can Garden Marker
22494,Emergency First Aid Tin
22508,Doorstop Retrospot Heart
22514,Childs Garden Spade Blue
22516,Childs Garden Rake Blue
22550,Holiday Fun Ludo
22563,Happy Stencil Craft
22587,Feltcraft Hairband Red And Blue
22588,Card Holder Gingham Heart
22604,Set Of 4 Napkin Charms Cutlery
22605,Wooden Croquet Garden Set
22639,Set Of 4 Napkin Charms Hearts
22640,Set Of 4 Napkin Charms 3 Keys
22642,Set Of 4 Napkin Charms Stars
22643,Set Of 4 Napkin Charms Leaves
22647,Ceramic Love Heart Money Bank
22675,French Kitchen Sign Blue Metal
22679,French Blue Metal Door Sign 4
22687,Doormat Christmas Village
22739,Ribbon Reel Christmas Sock Bauble
22743,Make Your Own Flowerpower Card Kit
22750,Feltcraft Princess Lola Doll
22756,Large Yellow Babushka Notebook
22771,Clear Drawer Knob Acrylic Edwardian
22792,Fluted Antique Candle Holder
22841,Round Cake Tin Vintage Green
22872,Number Tile Cottage Garden 4
22875,Number Tile Cottage Garden 7
22903,Calendar Family Favourites
22916,Herb Marker Thyme
22917,Herb Marker Rosemary
22918,Herb Marker Parsley
22919,Herb Marker Mint
22920,Herb Marker Basil
22921,Herb Marker Chives
22935,Baking Mould Rose Milk Chocolate
22944,Christmas Metal Postcard With Bells
22970,London Bus Coffee Mug
22974,Childrens Dolly Girl Mug
22978,Pantry Rolling Pin
23017,Apothecary Measuring Jar
23061,Vintage Embossed Heart
23087,Zinc Heart T-Light Holder
23100,Silver Bells Table Decoration
23119,Pack Of 6 Large Fruit Straws
23133,Large Ivory Heart Wall Organiser
23160,Regency Tea Spoon
23161,Regency Cake Fork
23164,Regency Cake Slice
23174,Regency Sugar Bowl Green
23211,Red Rocking Horse Hand Painted
23214,Jingle Bell Heart Antique Gold
23216,Laurel Heart Antique Gold
23218,Laurel Star Antique Gold
23219,Laurel Star Antique Silver
23221,Reindeer Heart Decoration Silver
23236,Storage Tin Vintage Doily
23263,Set Of 3 Wooden Heart Decorations
23269,Set Of 2 Ceramic Christmas Trees
23273,Heart T-Light Holder Willie Winkie
23286,Blue Vintage Spot Beaker
23289,Dolly Girl Childrens Bowl
23331,Decorative Wicker Heart Small
23339,Egg Frying Pan Blue
23346,Spaceboy Beaker
23393,Home Sweet Home Cushion Cover
23395,Belle Jardiniere Cushion Cover
23397,Foot Stool Home Sweet Home
23398,Hanging Heart Bonheur
23407,Set Of 2 Trays Home Sweet Home
23419,Home Sweet Home Bottle
23422,Pantry Hook Balloon Whisk
23423,Pantry 3 Hook Rolling Pin Hanger
23466,Tuscan Villa Dovecote Bird Feeder
23483,Hanging Butterfly T-Light Holder
23496,Pantry Kitchen Thermometer
23504,Playing Cards Jubilee Union Jack
23509,Mini Playing Cards Fun Fair
23511,Embroidered Ribbon Reel Emily
23528,Wall Art Spaceboy
23529,Wall Art Dolly Girl
23554,Landmark Frame Oxford Street
23566,Egg Cup Milkmaid Heidi
23576,Snack Tray Red Vintage Doily
23603,Set 10 Card Kraft Reindeer 17084
23614,Set 10 Cards 12 Days Wrap 17058
23636,Set 10 Cards Wishing Tree 17116
23645,Set 10 Christmas Cards Hohoho 16956
23694,Paisley Park Card
35961,Folkart Zinc Heart Christmas Dec
35967,Folk Art Metal Star T-Light Holder
47471,Rainbow Pegs Photo Clip String
47593B,Scottie Dogs Baby Bib
48173C,Doormat Black Flock
51014C,Feather Pen Coal Black
72122,Coffee Scent Pillar Candle
72131,Columbian Candle Rectangle
72132,Columbian Cube Candle
72799E,Ivory Pillar Candle Silver Flock
79144B,Painted Lightbulb Star+ Moon
79144C,Painted Lightbulb Rainbow Design
82616B,Frappucino Scarf Knitting Kit
82616C,Midnight Glamour Scarf Knitting Kit
84030E,English Rose Hot Water Bottle
84078A,Set/4 White Retro Storage Cubes
84535B,Fairy Cakes Notebook A6 Size
84792,Enchanted Bird Coathanger 5 Hook
84968D,Set Of 16 Vintage Red Cutlery
84992,72 Sweetheart Fairy Cake Cases
85032B,Blossom Images Gift Wrap Set
85034B,3 White Choc Morris Boxed Candles
85129C,Beaded Crystal Heart Blue Small
85170D,Set/6 Pink Bird T-Light Candles
85176,Sewing Susan 21 Needle Set
85179C,Pink Bitty Light Chain
85184C,Set 4 Valentine Decoupage Heart Box
90018A,Silver Mop Orbit Drop Earrings
90019C,Silver Black Orbit Bracelet
90022,Edwardian Drop Earrings Jet Black
90054,Cracked Glaze Earrings Red
90082A,Diamante Bow Brooch Green Colour
90146,Fine Silver Necklace W Pastel Flowe
90158,St Tropez Necklace
90161B,Ant Copper Turq Boudicca Bracelet
90182B,Amethyst 3 Bead Drop Earrings
90200D,Pink Sweetheart Bracelet
90200E,Green Sweetheart Bracelet
90202A,Purple Enamel Flower Hair Tie
90210C,Red Acrylic Faceted Bangle
23209,Lunch Bag Vintage Doily
16168M,Funky Monkey Gift Bag Medium
23436,Vintage Christmas Gift Bag Large
21285,Retrospot Candle Medium
21441,Blue Birdhouse Decoration
22063,Ceramic Bowl With Strawberry Design
22201,Frying Pan Blue Polkadot
22203,Milk Pan Red Retrospot
22204,Milk Pan Blue Polkadot
22221,Cake Stand Lovebird 2 Tier Pink
84817,Danish Rose Decorative Plate
84820,Danish Rose Trinket Trays
84821,Danish Rose Deluxe Coaster
22582,Pack Of 6 Sweetie Gift Boxes
22603,Christmas Retrospot Tree Wood
22609,Pens Assorted Spaceball
22636,Childs Breakfast Set Circus Parade
22671,French Laundry Sign Blue Metal
22672,French Bathroom Sign Blue Metal
22674,French Toilet Sign Blue Metal
22680,French Blue Metal Door Sign 5
22737,Ribbon Reel Christmas Present
22744,Make Your Own Monsoon Card Kit
22752,Set 7 Babushka Nesting Boxes
22766,Photo Frame Cornice
22772,Pink Drawer Knob Acrylic Edwardian
22784,Lantern Cream Gazebo
22801,Antique Glass Pedestal Bowl
22839,3 Tier Cake Tin Green And Cream
22840,Round Cake Tin Vintage Red
22853,Cat Bowl Vintage Cream
22897,Oven Mitt Apples Design
22902,Tote Bag I Love London
22930,Baking Mould Heart Milk Chocolate
22945,Christmas Metal Tags Assorted
23008,Dolly Girl Baby Gift Set
23086,Zinc Star T-Light Holder
23113,Pantry Chopping Board
23115,Red Apples Chopping Board
23120,Pack Of 6 Small Fruit Straws
23123,Cocktail Swords 50 Pieces
23162,Regency Tea Strainer
23163,Regency Sugar Tongs
23189,Set Of 12 Fork Candles
23225,Cherub Heart Decoration Silver
23227,Filigree Heart Butterfly White
23228,Filigree Heart Bird White
23242,Treasure Tin Buffalo Bill
23271,Christmas Table Silver Candle Spike
23288,Green Vintage Spot Beaker
23316,Red Refectory Clock
23329,Decorative Wicker Heart Large
23335,Egg Frying Pan Ivory
23401,Rustic Mirror With Lace Heart
23402,Home Sweet Home 3 Peg Hanger
23403,Letter Holder Home Sweet Home
23417,Bathroom Hook
23452,Heart Mini Portrait Frame
23465,Tuscan Villa Bird Feeder
23500,Key Ring Baseball Boot Assorted
23507,Mini Playing Cards Buffalo Bill
23512,Embroidered Ribbon Reel Rosie
23556,Landmark Frame Covent Garden
23560,Set Of 6 Ribbons Country Style
10133,Colouring Pencils Brown Tube
15034,Paper Pocket Traveling Fan
16048,Teatime Round Pencil Sharpener
17003,Brocade Ring Purse
20677,Pink Polkadot Bowl
20828,Glitter Butterfly Clips
20969,Red Floral Feltcraft Shoulder Bag
20997,Rose Du Sud Cushion Cover
21056,Doctor's Bag Soft Toy
21059,Party Invites Dinosaurs
21191,Large White Honeycomb Paper Bell
21210,Set Of 72 Retrospot Paper Doilies
21243,Pink Polkadot Plate
21377,Small Camphor Wood Field Mushroom
21385,Ivory Hanging Decoration Heart
21400,Red Pudding Spoon
21401,Blue Pudding Spoon
21403,Blue Egg Spoon
21561,Dinosaur Lunch Box With Cutlery
21577,Save The Planet Cotton Tote Bag
21695,Small Silver Flower Candle Pot
21715,Girls Vintage Tin Seaside Bucket
21733,Red Hanging Heart T-Light Holder
21866,Union Jack Flag Luggage Tag
21878,Pack Of 6 Sandcastle Flags Assorted
21913,Vintage Seaside Jigsaw Puzzles
21917,Set 12 Kids White Chalk Sticks
21922,Union Stripe With Fringe Hammock
22115,Metal Sign Empire Tea
22131,Food Container Set 3 Love Heart
22133,Pink Love Heart Shape Cup
22158,3 Hearts Hanging Decoration Rustic
22189,Cream Heart Card Holder
22191,Ivory Diner Wall Clock
22192,Blue Diner Wall Clock
22222,Cake Plate Lovebird White
22321,Bird Decoration Red Retrospot
22376,Airline Bag Vintage Jet Set White
22377,Bottle Bag Retrospot
22390,Paperweight Childhood Memories
22393,Paperweight Vintage Collage
22428,Enamel Fire Bucket Cream
22439,6 Rocket Balloons
22493,Paint Your Own Canvas Set
22523,Childs Garden Fork Pink
22543,Mini Jigsaw Bake A Cake
22546,Mini Jigsaw Purdey
22547,Mini Jigsaw Dinosaur
22562,Monsters Stencil Craft
22564,Alphabet Stencil Craft
23568,Egg Cup Henrietta Hen Cream
23626,Set 10 Cards Dinky Tree 17076
23637,Set 10 Cards Out Of Order 17216
23640,Set 10 Cards Scottie Dog 17211
23650,Set 10 Cards Filigree Bauble 16961
23695,Doily Thank You Card
35649,Vintage Bead Cosmetic Bag
35924,Hanging Fairy Cake Decoration
37447,Ceramic Cake Design Spotted Plate
37450,Ceramic Cake Bowl + Hanging Cakes
47578A,English Rose Small Scented Flower
47591D,Pink Fairy Cake Childrens Apron
70006,Love Heart Pocket Warmer
72598,Set/12 Taper Candles
79403,Frosted White Base
82578,Kitchen Metal Sign
84536A,English Rose Notebook A7 Size
84580,Mouse Toy With Pink T-Shirt
84596G,Small Chocolates Pink Bowl
84661A,White Square Table Clock
84661B,Black Square Table Clock
84836,Zinc Metal Heart Decoration
84949,Silver Hanging T-Light Holder
84950,Assorted Colour T-Light Holder
84988,Set Of 72 Pink Heart Paper Doilies
85025B,Eau De Nile Heart Shape Photo Frame
85039C,S/4 Black Mini Rose Candle In Bowl
85169A,Ivory Love Bird Candle
85169B,Black Love Bird Candle
85231B,Cinammon Set Of 9 T-Lights
85232D,Set/3 Decoupage Stacking Tins
90016C,Silver/Black Pendant Orbit Necklace
90039C,Fire Polished Glass Bracelet Black
90083,Crystal Czech Cross Phone Charm
90101,White Frangipani Necklace
90114,Summer Daisies Bag Charm
90160C,Turq+Red Boudicca Large Bracelet
90161A,Ant Copper Red Boudicca Bracelet
90161C,Ant Copper Lime Boudicca Bracelet
90166,Pink & White Rosebud Ring
90179A,Amber Fine Bead Necklace W Tassel
90187B,Green Drop Earrings W Bead Cluster
90200B,Black Sweetheart Bracelet
90206A,Gold Diamante Star Brooch
85099F,Jumbo Bag Strawberry
22382,Lunch Bag Spaceboy Design
21289,Large Stripes Chocolate Gift Bag
16258A,Swirly Circular Rubbers In Bag
22438,Balloon Art Make Your Own Flowers
20992,Jazz Hearts Purse Notebook
85199L,Large Hanging Ivory & Red Wood Bird
22509,Sewing Box Retrospot Design
20996,Jazz Hearts Address Book
85071B,Red Charlie+Lola Personal Doorsign
21051,Ribbons Purse
23341,Pink Diner Wall Clock
23281,Folding Butterfly Mirror Red
22492,Mini Paint Set Vintage
22536,Magic Drawing Slate Purdey
22534,Magic Drawing Slate Spaceboy
22530,Magic Drawing Slate Dolly Girl
22046,Tea Party Wrapping Paper
22708,Wrap Dolly Girl
21498,Red Retrospot Wrap
15056P,Edwardian Parasol Pink
23176,Abc Treasure Book Box
23394,Poste France Cushion Cover
23396,Le Jardin Botanique Cushion Cover
22846,Bread Bin Diner Style Red
23455,Small Parlour Picture Frame
21623,Vintage Union Jack Memoboard
21135,Victorian Metal Postcard Spring
20676,Red Retrospot Bowl
21042,Red Retrospot Apron
21452,Toadstool Money Box
21581,Skulls Design Cotton Tote Bag
21881,Cute Cats Tape
21944,Kittens Design Flannel
21974,Set Of 36 Paisley Flower Doilies
22136,Love Heart Sock Hanger
22166,Wall Mirror Rectangle Diamante Pink
22414,Doormat Neighbourhood Witch
22425,Enamel Colander Cream
22468,Babushka Lights String Of 10
22470,Heart Of Wicker Large
22669,Red Baby Bunting
22692,Doormat Welcome To Our Home
22781,Gumball Magazine Rack
22972,Children's Spaceboy Mug
23474,Woodland Small Blue Felt Heart
37340,Multicolour Spring Flower Mug
47591B,Scotties Childrens Apron
72801D,4 Sky Blue Dinner Candles
82494L,Wooden Frame Antique White
85114B,Ivory Enchanted Forest Placemat
22923,Fridge Magnets Les Enfants Assorted
21770,Open Closed Metal Sign
23400,Shelf With 4 Hooks Home Sweet Home
23321,Small White Heart Of Wicker
22804,Pink Hanging Heart T-Light Holder
23081,Green Metal Box Army Supplies
23427,Stool Home Sweet Home
23413,Decorative Vintage Coffee Box
20932,Pink Pot Plant Candle
20933,Yellow Pot Plant Candle
20675,Blue Polkadot Bowl
21240,Blue Polkadot Cup
22426,Enamel Wash Bowl Cream
21576,Lets Go Shopping Cotton Tote Bag
22709,Wrap Wedding Day
23233,Wrap Poppies Design
23232,Wrap Vintage Leaf Design
22487,White Wood Garden Plant Ladder
21628,Triangular Pouffe Vintage
84006,Magic Tree -Paper Flowers
21495,Skulls And Crossbones Wrap
23499,Set 12 Vintage Doily Chalk
23101,Silver Stars Table Decoration
21592,Retrospot Cigar Box Matches
22746,Poppy's Playhouse Livingroom
22584,Pack Of 6 Panettone Gift Boxes
23109,Pack Of Six Led Tea Lights
21588,Retrospot Giant Tube Matches
23505,Playing Cards I Love London
22607,Wooden Rounders Garden Set
23106,Zinc Hearts Plant Pot Holder
22959,Wrap Christmas Village
23531,Wall Art Big Love
23532,Wall Art Work Rest And Play
20975,12 Pencils Small Tube Red Retrospot
22595,Gingham Heart Decoration
22475,Skull Design Tv Dinner Tray
22094,Red Retrospot Tissue Box
22092,Blue Paisley Tissue Box
21262,White Goose Feather Christmas Tree
23548,Wrap Magic Forest
21867,Pink Union Jack Luggage Tag
21865,Pink Union Jack Passport Cover
47421,Assorted Colour Lizard Suction Hook
84920,Pink Flower Fabric Pony
22430,Enamel Watering Can Cream
23192,Bundle Of 3 Alphabet Exercise Books
23179,Clock Magnet Mum's Kitchen
22953,Birthday Party Cordon Barrier Tape
84951B,Set Of 4 Black Lovebird Coasters
23075,Parlour Ceramic Wall Hook
72351A,Set/6 Turquoise Butterfly T-Lights
