ProductNo,ProductName
20751,Funky Washing Up Gloves Assorted
23456,Medium Parlour Picture Frame
23514,Embroidered Ribbon Reel Sally
23420,Pantry Hook Tea Strainer
23421,Pantry Hook Spatula
23152,Ivory Sweetheart Wire Letter Rack
23069,Edwardian Photo Frame
21682,Large Medina Stamped Metal Bowl
10120,Doggy Rubber
47566B,Tea Time Party Bunting
21761,Wood And Glass Medicine Cabinet
23433,Hanging Quilted Patchwork Apples
20655,Queen Of Skies Luggage Tag
21709,Folding Umbrella Chocolate Polkadot
21389,Ivory Hanging Decoration Bird
21114,Lavender Scented Fabric Heart
16054,Popart Rect Pencil Sharpener Asst
21061,Party Invites Football
21849,Silver Diamante Pen In Gift Box
23130,Mistletoe Heart Wreath Green
22729,Alarm Clock Bakelike Orange
21279,Vintage Kitchen Print Fruits
47420,Assorted Colour Suction Cup Hook
20766,Garden Path Sketchbook
84192,Assorted Colour Metal Cat
84968A,Set Of 16 Vintage Rose Cutlery
21311,Set/4 Bird Mirror Magnets
22230,Jigsaw Tree With Watering Can
85159A,Black Tea Coffee Sugar Jars
85183B,Charlie & Lola Wastepaper Bin Flora
84581,Dog Toy With Pink Crochet Skirt
84247E,Pack Of 12 Christmas Fun Cards
16169M,Wrap Daisy Carpet
22707,Wrap Monster Fun
16156L,Wrap Carousel
16161U,Wrap Suki And Friends
21199,Pink Heart Confetti In Tube
21380,Wooden Happy Birthday Garland
21197,Multicolour Confetti In Tube
22399,Magnets Pack Of 4 Childhood Memory
23025,Drawer Knob Vintage Glass Ball
23027,Drawer Knob Vintage Glass Hexagon
21804,White Christmas Garland Stars Trees
22683,French Blue Metal Door Sign 8
22677,French Blue Metal Door Sign 2
23471,Six Drawer Office Tidy
71050,Small Single Flame Candle Holder
85230A,Opium Scented Votive Candle
85230G,Orange Votive Candle
22337,Angel Decoration Painted Zinc
22535,Magic Drawing Slate Bunnies
21789,Kids Rain Mac Pink
21062,Party Invites Spaceman
84913B,Mint Green Rose Towel
22043,Christmas Card Screen Print
84922,Pink Butterfly Washbag
37475,Set/4 Colourful Mixing Bowls
84924A,Wake Up Cockerel Calendar Sign
17012A,Origami Vanilla Incense/Candle Set
84796A,Pink Hawaiian Picnic Hamper For 2
21205,Multicolour 3d Balls Garland
23518,Embroidered Ribbon Reel Rachel
22761,Chest 7 Drawer Ma Campagne
47599B,Blue Party Bags
47599A,Pink Party Bags
90125B,Aqua Bertie Glass Bead Bag Charm
90085,Crystal Stiletto Phone Charm
90164A,Pink Rosebud Pearl Bracelet
21106,Cream Slice Flannel Chocolate Spot
21721,Candy Shop Sticker Sheet
22702,Black And White Cat Bowl
23625,Set 6 Cards Sparkly Reindeer 17262
90010E,Amber Glass/Silver Bracelet
90036C,"Flower Glass Garland Neckl36""Blue"
90041,Pearl And Cherry Quartz Braclet
90122C,Turquoise Crystal+Glass Bracelet
90133,Teal/Fuschia Col Bead Necklace
90149,Silver Flowr Pink Shell Necklace
90176E,Diamante Necklace Green
90177D,Drop Diamante Earrings Purple
90199B,5 Strand Glass Necklace Amethyst
22820,Gift Bag Birthday
23411,Trellis Coat Rack
22826,Love Seat Antique White Metal
23348,Childrens Toy Cooking Utensil Set
85175,Cacti T-Light Candles
72586,Set Of 6 Halloween Ghost T-Lights
90179C,Black Fine Bead Necklace W Tassel
20894,Hanging Bauble T-Light Holder Large
23549,Wrap Bird Garden
84279B,Cherry Blossom Decorative Flask
21374,Mirrored Wall Art Skulls
22147,Feltcraft Butterfly Hearts
72802A,Rose Scent Candle In Jewelled Box
21354,Toast Its - Best Mum
23431,Natural Hanging Quilted Hearts
21464,Disco Ball Rotator Battery Operated
35923,Candy Heart Hanging Decoration
21066,Vintage Red Mug
22286,Decoration Wobbly Rabbit Metal
22287,Decoration Wobbly Chicken
21382,Set/4 Spring Flower Decoration
84926A,Wake Up Cockerel Tile Coaster
21465,Pink Flower Crochet Food Cover
21927,Blue/Cream Stripe Cushion Cover
47585A,Pink Fairy Cake Cushion Cover
23044,Paper Lantern 9 Point Holly Star S
23478,Woodland Large Pink Felt Heart
23049,Recycled Acapulco Mat Red
23073,Georgian Trinket Box
22831,White Brocante Soap Dish
21758,Vintage Shells Print
21793,Classic French Style Basket Brown
21972,Set Of 36 Dinosaur Paper Doilies
47369A,Pink Green Embroidery Cosmetic Bag
47369B,Blue Green Embroidery Cosmetic Bag
90108,Blue Blossom Hair Clip
90143,Silver Bracelet W Pastel Flower
90204,Pair Of Enamel Butterfly Hairclip
20661,Blue Polkadot Purse
20711,Jumbo Bag Toys
47422,Assorted Monkey Suction Cup Hook
85114A,Black Enchanted Forest Placemat
22886,Number Tile Vintage Font 7
84849D,Hot Baths Soap Holder
85159B,White Tea Coffee Sugar Jars
23032,Drawer Knob Crackle Glaze Ivory
72807C,Set/3 Vanilla Scented Candle In Box
21422,Porcelain Rose Small
84931A,Pink Scottie Dog W Flower Pattern
23448,Cream Bunny Easter Egg Basket
21688,Silver Plate Candle Bowl Small
23692,Wrap A Pretty Thank You
22759,Set Of 3 Notebooks In Parcel
20819,Silver Teddy Bear
22243,5 Hook Hanger Red Magic Toadstool
21032,Space Cadet White
23476,Woodland Large Red Felt Heart
22884,Number Tile Vintage Font 5
84086C,Pink/Purple Retro Radio
21747,Small Skull Windmill
84876B,Green Heart Compact Mirror
84877B,Green Round Compact Mirror
35810B,Enamel Blue Rim Coffee Container
23414,Zinc Box Sign Home
84795B,Sunset Check Hammock
17012B,Origami Jasmine Incense/Candle Set
16254,Transparent Acrylic Tape Dispenser
84592,Crochet Rose Purse With Suede Back
22947,Wooden Advent Calendar Red
23630,Set 10 Cards Hanging Baubles 17080
23632,Set 10 Cards Cheerful Robin 17065
85088,Candy Spot Hand Bag
90011B,Black Crystal Drop Earrings
90013B,Black Vintage Earrings
90024F,New Baroque B'fly Necklace Crystal
90141A,Green Pendant Triple Shell Necklace
90152A,Silver/Nat Shell Necklace W Pendant
90181A,Amber Glass/Shell/Pearl Necklace
21250,Set Of Skull Wall Stickers
21251,Dinosaur Height Chart Sticker Set
23477,Woodland Large Blue Felt Heart
35819B,Acrylic Hanging Jewel Blue
21503,Toybox Wrap
35598B,Black Christmas Tree 60cm
47341B,Blue Table Run Flower
85185B,Pink Horse Sock Puppet Kit
84882,Green Wire Standing Candle Holder
72802C,Vanilla Scent Candle Jewelled Box
84849A,Hello Sailor Blue Soap Holder
21746,Small Red Retrospot Windmill
84228,Hen House With Chick Standing
72225C,Lavender Scent Cake Candle
90196A,Purple Gemstone Necklace 45cm
85208,Set/12 Funky Felt Flower Peg In Bag
21841,Baby Mouse Red Gingham Dress
90186B,Crystal Hoop Earring Floral Leaf
90190C,Silver/Amethyst Drop Earrings Leaf
21814,Heart T-Light Holder
22317,Five Cats Hanging Decoration
21129,Silver Fishing Gnome
85135A,Yellow Dragonfly Helicopter
85169D,Pink Love Bird Candle
47518F,Icon Placemat Pop Art Elvis
21468,Butterfly Crochet Food Cover
23149,Antique Ivory Wire Bowl Small
85202,Hanging Wood And Felt Heart
22265,Easter Decoration Natural Chick
22325,Mobile Vintage Hearts
22181,Snowstorm Photo Frame Fridge Magnet
22832,Brocante Shelf With Hooks
22870,Number Tile Cottage Garden 2
22869,Number Tile Cottage Garden 1
22572,Rocking Horse Green Christmas
23623,Set 10 Card Christmas Welcome 17112
84748,Folk Felt Hanging Multicol Garland
90180A,Black+White Necklace W Tassel
90186A,Amethyst Hoop Earring Floral Leaf
90199D,5 Strand Glass Necklace Amber
21749,Large Red Retrospot Windmill
23125,6pc Wood Plate Set Disposable
23617,Set 10 Cards Swirly Xmas Tree 17104
90003B,Rose Colour Pair Heart Hair Slides
90003D,Crystal Pair Heart Hair Slides
90033,Ivory Shell Heart Earrings
90199C,5 Strand Glass Necklace Crystal
47481,50cm Metal String With 7 Clips
85170B,Set/6 Black Bird T-Light Candles
71406C,Black Orange Squeezer
23159,Set Of 5 Pancake Day Magnets
71038,White Hanging Beads Candle Holder
21973,Set Of 36 Mushroom Paper Doilies
16046,Teatime Pen Case & Pens
21845,Dairy Maid Stripe Mug
47503A,Ass Floral Print Multi Screwdriver
22164,String Of Stars Card Holder
20748,Kensington Coffee Set
21211,Set Of 72 Skull Paper Doilies
21882,Skulls Tape
72800D,4 Blue Dinner Candles Silver Flock
72369A,Pink Clear Glass Candle Plate
85106,Cut Glass Hexagon T-Light Holder
90030A,Spotted White Natural Seed Necklace
75011,Blue Daisy Mobile
22912,Yellow Coat Rack Paris Fashion
79151B,Silicon Cube 25w Blue
78124,Magazine Rack Gebra Assorted
22427,Enamel Flower Jug Cream
21291,Small Polkadot Chocolate Gift Bag
22102,Mirror Mosaic T-Light Holder
22579,Wooden Tree Christmas Scandinavian
23094,Le Grand Tray Chic Set
23601,Set 10 Cards Snowy Snowdrops 17100
23609,Set 10 Cards Snowy Robin 17099
23613,Set 10 Xmas Cards & Badges 17070
90074,Black Diamond Cluster Necklace
90123D,White Heart Of Glass Bracelet
90130D,Red Stone/Crystal Earrings
90144,Silver Drop Earrings With Flower
90157,Riviera Necklace
90205C,Large Crystal Diamante Hairslide
22450,Silk Purse Babushka Blue
22689,Doormat Merry Christmas Red
85054,French Enamel Pot W Lid
21372,Mirrored Wall Art Table Lamp
85125,Small Round Cut Glass Candlestick
20752,Blue Polkadot Washing Up Gloves
22637,Piggy Bank Retrospot
22503,Cabin Bag Vintage Paisley
20770,Abstract Circle Journal
85161,Acrylic Geometric Lamp
84842,Hello Sailor Bathroom Set
21647,Assorted Tutti Frutti Large Purse
20757,Red Daisy Pocket Book
84706F,Red Peony Table Clock
21816,Christmas Tree T-Light Holder
22715,Card Wedding Day
85187,S/12 Mini Rabbit Easter
21192,White Bell Honeycomb Paper
44089A,Pink Gauze Butterfly Lampshade
16162M,The King Gift Bag 25x24x12cm
23142,Ivory Wire Kitchen Organiser
35637C,Pink String Curtain With Pole
35637A,Ivory String Curtain With Pole
22825,Decorative Plant Pot With Frieze
85035C,Rose 3 Wick Morris Box Candle
79063D,Retro Pill Box Revolutionary
90082D,Diamante Bow Brooch Black Colour
90151,Silver/Natural Shell Necklace
90023,Filigree Diamante Earrings
90147,Chunky Silver Necklace Pastel Flowe
90014C,Silver And Black Orbit Necklace
23325,Rustic Strawberry Jam Pot Small
81952V,Round Purple Clock With Sucker
84247N,Pack/12 Blue Folkart Cards
21644,Assorted Tutti Frutti Heart Box
84508B,Stripes Design Teddy
22271,Feltcraft Doll Rosie
21110,Large Cake Towel Pink Spots
22032,Botanical Lily Greeting Card
90030C,Brown Kukui Coconut Seed Necklace
90031,Bili Nut And Wood Necklace
21226,Pocket Mirror Woodland
90098,Necklace+Bracelet Pink Butterfly
84527,Flames Sunglasses Pink Lenses
22665,Recipe Box Blue Sketchbook Design
21710,Folding Umbrella Pinkwhite Polkadot
84206C,Champagne Tray Blank Card
84201B,Happy Birthday Card Stripey Teddy
84206A,3 Black Cats W Hearts Blank Card
20847,Zinc Heart Lattice Charger Large
22611,Vintage Union Jack Shopping Bag
72799F,Ivory Pillar Candle Gold Flock
21190,Pink Hearts Paper Garland
23410,Curio Cabinet Linen And Lace
84550,Crochet Lilac/Red Bear Keyring
22873,Number Tile Cottage Garden 5
23627,Set 10 Cards Xmas Graphic 17218
23629,Set 10 Cards Dressing Up 17077
23649,Set 10 Cards Deck The Halls 16960
90000D,Copper/Olive Green Flower Necklace
90018C,Silver Black Orbit Drop Earrings
22292,Hanging Chick Yellow Decoration
22291,Hanging Chick Cream Decoration
22247,Bunny Decoration Magic Garden
22258,Felt Farm Animal Rabbit
22034,Robin Christmas Card
72807A,Set/3 Rose Candle In Jewelled Box
84971L,Large Heart Flowers Hook
90027B,Glass Bead Hoop Earrings Montana
90027C,Glass Bead Hoop Earrings Green
90060F,Fire Polished Glass Neckl Green
90130A,White Stone/Crystal Earrings
22162,Heart Garland Rustic Padded
23519,Embroidered Ribbon Reel Claire
23607,Set 10 Cards Hats & Stockings 17081
23638,Set 10 Cards Robin Waterpump 17096
85124B,Blue Juicy Fruit Photo Frame
90075,Montana Diamond Cluster Necklace
90076,Montana Diamond Cluster Earrings
90190A,Silver/Crystal Drop Earrings W Leaf
72807B,Set/3 Ocean Scent Candle Jewel Box
84870B,Blue Geisha Girl
90011C,Green Crystal Drop Earrings
90038A,Glass And Painted Beads Bracelet To
90070,Ruby Glass Cluster Bracelet
90129E,Purple Glass Tassle Bag Charm
90205A,Large Mint Diamante Hairslide
22246,Magic Garden Felt Garland
17090A,Lavender Incense 40 Cones In Tin
16161G,Wrap Bad Hair Day
22449,Silk Purse Babushka Pink
35598C,White Christmas Tree 60cm
23047,Paper Lantern 5 Point Sequin Star
21744,Snowflake Portable Table Light
71495A,Cd Wall Tidy Blue Office
71495B,Cd Wall Tidy Red Flowers
22778,Glass Cloche Small
22051,Blue Scandinavian Paisley Wrap
47594A,Carousel Design Washbag
84929,Asstd Fruit+Flowers Fridge Magnets
20760,Garden Path Pocket Book
21711,Folding Umbrella White/Red Polkadot
90011A,Midnight Blue Crystal Drop Earrings
22954,Hen Party Cordon Barrier Tape
23015,Cordial Glass Jug
35443,Rasta In Bath W Spliff Ashtray
17174,Asstd Rasta Key-Chains
84673A,Pink Fly Swat
35833P,4 Pink Flock Christmas Balls
71510,Square Metal Candleholder Base
22652,Travel Sewing Kit
22824,3 Tier Sweetheart Garden Shelf
85034A,3 Gardenia Morris Boxed Candles
22241,Garland Wooden Happy Easter
85036C,Rose 1 Wick Morris Boxed Candle
84801A,Pink Hydrangea Art Flower
84968C,Set Of 16 Vintage Pistachio Cutlery
21556,Ceramic Strawberry Money Box
20698,Little Pink Monster Soft Toy
20697,Little Green Monster Soft Toy
21811,Hanging Heart With Bell
15058A,Blue Polkadot Garden Parasol
21815,Star T-Light Holder
21206,Strawberry Honeycomb Garland
22236,Cake Stand 3 Tier Magic Garden
21014,Swiss Chalet Tree Decoration
21830,Assorted Creepy Crawlies
23056,Flowers Chandelier T-Light Holder
72817,Set Of 2 Christmas Decoupage Candle
90049,Ivory Gold Metal Bag Charm
21117,Blond Doll Doorstop
22125,Union Jack Hot Water Bottle
21041,Red Retrospot Oven Glove Double
35400,Wooden Box Advent Calendar
21696,Small Silver Trellis Candlepot
85163A,White Baroque Wall Clock
82011C,Bathroom Scales Footprints In Sand
82011B,Bathroom Scales Rubber Ducks
21277,French Style Embossed Heart Cabinet
20821,Goldie Looking Mirror
23468,Tuscan Villa Bird Table
21459,Yellow Easter Egg Hunt Start Post
21461,Blue Easter Egg Hunt Start Post
22339,Christmas Tree Painted Zinc
84616,Silver Roccoco Chandelier
22293,Hanging Chick Green Decoration
22289,Hanging Metal Chicken Decoration
21407,Brown Check Cat Doorstop
22892,Set Of Salt And Pepper Toadstools
23297,Set 40 Heart Shape Petit Four Cases
37370,Retro Coffee Mugs Assorted
40005B,Blue Organdy Round Lampshade W Bea
85024C,Pink Small Jewelled Photoframe
84522,Pink Party Sunglasses
21269,Antique Cream Cutlery Shelf
79161A,St George Set Of 10 Party Lights
20694,Floral Pink Monster
22033,Botanical Rose Greeting Card
90011D,Purple Crystal Drop Earrings
90190B,Gold/Amber Drop Earrings W Leaf
21807,White Christmas Star Decoration
90141C,Turq Pendant Triple Shell Necklace
20756,Green Fern Pocket Book
85194L,Hanging Spring Flower Egg Large
22270,Happy Easter Hanging Decoration
21633,Sunflower Decorative Parasol
23064,Cinderella Chandelier
84659A,White Travel Alarm Clock
21802,Christmas Tree Heart Decoration
37489B,Blue/Yellow Flower Design Big Mug
37489A,Yellow/Pink Flower Design Big Mug
21391,French Lavender Scent Heart
21027,Ninja Rabbit Pink
21030,Space Cadet Red
71101E,Standing Fairy Pole Support
21562,Hawaiian Grass Skirt
23633,Set 10 Cards World Children 17067
90177E,Drop Diamante Earrings Green
21617,4 Lily Botanical Dinner Candles
22206,Mug Dotcomgiftshopcom
22868,Number Tile Cottage Garden 0
10080,Groovy Cactus Inflatable
23057,Beaded Chandelier T-Light Holder
23055,Ivory Chandelier T-Light Holder
21626,Vintage Union Jack Pennant
84665,Square Cherry Blossom Cabinet
21473,Sweetheart Cream Steel Table Rect
84824,Danish Rose Umbrella Stand
23268,Set Of 2 Ceramic Christmas Reindeer
20754,Retrospot Red Washing Up Gloves
22856,Assorted Easter Decorations Bells
84206B,Cat With Sunglasses Blank Card
35591T,Turquoise Christmas Tree
15060B,Fairy Cake Design Umbrella
35638A,Pink And Black String Curtain
35638B,Pink/Blue String Curtain
84663A,Grass Hopper Wooden Wall Clock
35598A,Dusty Pink Christmas Tree 60cm
23065,Large Deco Jewellery Stand
85216,Assorted Cakes Fridge Magnets
90189A,Silver 2 Strand Necklace-Leaf Charm
90026D,Glass Bead Hoop Necklace Amethyst
90154,Lazer Cut Necklace W Pastel Beads
22570,Feltcraft Cushion Rabbit
22860,Easter Tin Chicks Pink Daisy
23620,Set 10 Cards Perfect Post 17090
84459A,Pink Metal Chicken Heart
22827,Rustic Seventeen Drawer Sideboard
21631,Hippy Chic Decorative Parasol
22040,Botanical Rose Gift Wrap
21202,Dolly Honeycomb Garland
22904,Calendar Paper Cut Design
15058B,Pink Polkadot Garden Parasol
84508C,Blue Circles Design Teddy
85135B,Blue Dragonfly Helicopter
85036B,Chocolate 1 Wick Morris Box Candle
90160D,Pink Boudicca Large Bracelet
21725,Sweeties Stickers
20695,Floral Blue Monster
85089,Candy Spot Bunny
23612,Set 10 Minicards Cute Snowman 17071
23639,Set 10 Cards Magical Tree 17086
23646,Set 10 Cards Jingle Bells 16957
23652,Set 10 Card Christmas Stamps 16963
90064A,White Vintage Crystal Earrings
90175C,Blue Glass Chunky Charm Bracelet
16015,Medium Chinese Style Scissor
22828,Regency Mirror With Shutters
21331,Moroccan Beaten Metal Dish Large
23018,Large Apothecary Measuring Jar
22454,Measuring Tape Babushka Red
21741,Cosy Slipper Shoes Large Green
21031,Space Cadet Black
71403,"Pink/White ""Keep Clean"" Bullet Bin"
21145,Antique Glass Place Setting
90000A,Raspberry Ant Copper Flower Necklac
90185A,Amber Diamante Expandable Ring
22871,Number Tile Cottage Garden 3
22878,Number Tile Cottage Garden No
21847,Green Diamante Pen In Gift Box
90165A,Pink Rosebud Pearl Earrings
90176B,Diamante Necklace Black
20935,Round Cactus Candle
85036A,Gardenia 1 Wick Morris Boxed Candle
22823,Chest Natural Wood 20 Drawers
90067A,Pink Vintage Victorian Earrings
21824,Painted Metal Star With Holly Bells
21823,Painted Metal Heart With Holly Bell
22880,Number Tile Vintage Font 1
21643,Assorted Tutti Frutti Mirror
84341B,Small Pink Magic Christmas Tree
21992,Vintage Paisley Stationery Set
84497,Buttons And Stripes Notebook
72801G,4 Burgundy Wine Dinner Candles
22859,Easter Tin Bunny Bouquet
20670,Vip Holiday Purse
21352,Eucalyptus & Pinecone Wreath
90052,Cracked Glaze Necklace Brown
35965,Folkart Heart Napkin Rings
90122A,Pink Crystal+Glass Bracelet
23449,Set Of 6 Easter Rainbow Chicks
84744,S/6 Sew On Crochet Flowers
84687,Beach Hut Shelf W 3 Drawers
84617,New Baroque Black Boxes
21054,Nurse's Bag Soft Toy
23024,Large Bonne Jam Jar T-Light Holder
20901,Vintage Keepsake Box Pink Flower
21618,4 Wildflower Botanical Candles
84952A,Clear Love Bird T-Light Holder
85131C,Beaded Crystal Heart Blue On Stick
21539,Red Retrospot Butter Dish
90050,Cracked Glaze Necklace Ivory
22803,Ivory Embroidered Quilt
84968F,Set Of 16 Vintage Sky Blue Cutlery
40001,White Bamboo Ribs Lampshade
90012B,Black Drop Crystal Necklace
16259,Piece Of Camo Stationery Set
21394,Red Polkadot Beaker
22183,Cake Stand Victorian Filigree Med
22548,Heads And Tails Sporting Fun
23140,Triple Wire Hook Ivory Heart
21413,Periwinkle T-Light Holder
46138B,Blue Chenille Shaggy Cushion Cover
35819P,Acrylic Hanging Jewel Pink
82011A,Bathroom Scales Tropical Beach
90096,Necklace+Bracelet Set Blue Blossom
72709,Ivory Sculpted Rnd Candle
85160B,Black Bird Garden Design Mug
90124B,Blue Murano Twist Necklace
23610,Set 10 Cards Christmas Robin 17095
23624,Set 10 Card Perfect Nativity 17089
20657,Tropical Luggage Tag
22322,Bird Decoration Green Polkadot
22934,Baking Mould Easter Egg White Choc
23602,Set 10 Cards 3 Wise Men 17107
20696,Floral Soft Car Toy
23664,Flower Shop Design Mug
22829,Sweetheart Wire Wall Tidy
21275,Zinc Top 2 Door Wooden Shelf
22149,Feltcraft 6 Flower Friends
20796,Small Blue Provencal Ceramic Ball
37327,Asstd Multicolour Circles Mug
85230F,Jasmine Votive Candle
90210D,Purple Acrylic Faceted Bangle
90184A,Amber Chunky Bead Bracelet W Strap
35651,Vintage Bead Pink Scarf
22268,Decoration Sitting Bunny
22412,Metal Sign Neighbourhood Witch
23091,Zinc Herb Garden Container
79030D,Tumbler Baroque
90196B,Black Gemstone Necklace 45cm
90162B,Ant Silver Lime Green Boudicca Ring
90026C,Glass Bead Hoop Necklace Green
47504K,English Rose Garden Secateurs
90065B,Black Vint Art Dec Crystal Bracelet
90159,Cote D'azure Necklace
90195B,Black Gemstone Bracelet
90160B,Red Boudicca Large Bracelet
21817,Glitter Christmas Tree
21458,2 Picture Book Eggs Easter Bunny
21457,2 Picture Book Eggs Easter Ducks
84457,Set/3 Rabbits Flower Skippping Rope
35954,Small Folkart Star Christmas Dec
22874,Number Tile Cottage Garden 6
71279,Pink Glass Candleholder
90175B,Pink Glass Chunky Charm Bracelet
21281,Vintage Kitchen Print Seafood
21280,Vintage Kitchen Print Vegetables
84796B,Blue Savannah Picnic Hamper For 2
85017B,Envelope 50 Blossom Images
47594B,Scotties Design Washbag
84984A,Green Peony Cushion Cover
84984B,Red Peony Cushion Cover
84984D,Oriental Red Cushion Cover
37479P,Cubic Mug Flock Pink On Brown
22053,Empire Design Rosette
23619,Set 10 Cards Poinsettia 17093
21750,Large Skull Windmill
84549,Crochet White Rabbit Keyring
90001B,Antique Mid Blue Flower Earrings
90176A,Classic Diamante Necklace Jet
90176D,Diamante Necklace Purple
22180,Retrospot Lamp
21586,Kings Choice Giant Tube Matches
22950,36 Doilies Vintage Christmas
90162A,Ant Silver Turquoise Boudicca Ring
20886,Box Of 9 Pebble Candles
22044,Christmas Card Stack Of Presents
79164,Black Wine Glass
84913A,Soft Pink Rose Towel
20977,36 Pencils Tube Woodland
72803A,Rose Scent Candle Jewelled Drawer
35913B,White/Pink Chick Easter Decoration
35909B,Pink Flowers Rabbit Easter
35933,Pink Stocking Christmas Decoration
10124G,Army Camo Bookcover Tape
10124A,Spots On Red Bookcover Tape
47351B,Blue Voile Lampshade
20848,Zinc Heart Lattice Charger Small
35972,Daisy Folkart Heart Decoration
16207A,Pink Strawberry Handbag
22501,Picnic Basket Wicker Large
90209A,Purple Enamel+Glass Hair Comb
84231,Easter Bunny With Basket On Back
84465,15 Pink Fluffy Chicks In Box
20934,Set/3 Pot Plant Candles
35911A,Multicolour Rabbit Egg Warmer
84944,Set Of 6 Kashmir Folkart Baubles
72802B,Ocean Scent Candle In Jewelled Box
90124C,Green Murano Twist Necklace
90211B,Jet Black Las Vegas Necklace 45cm
90199A,5 Strand Glass Necklace Black
90069,Ruby Glass Cluster Necklace
90063A,White Vint Art Deco Crystal Necklac
90063B,Black Vint Art Dec Crystal Necklace
23124,18pc Wooden Cutlery Set Disposable
85093,Candy Spot Egg Warmer Hare
21395,Blue Polkadot Beaker
23187,French Style Storage Jar Bonbons
17136A,Blue Stones On Wire For Candle
79157V,Ubo-Light Triobase Purple
84766,Silver Rococo Candle Stick
85045,Green Christmas Tree String 20light
23028,Drawer Knob Crackle Glaze Blue
84559B,3d Sheet Of Cat Stickers
71496B,A4 Wall Tidy Red Flowers
71496A,A4 Wall Tidy Blue Office
85078,Scandinavian 3 Hearts Napkin Ring
90028,New Baroque Large Necklace Blk/Whit
22655,Vintage Red Kitchen Cabinet
84050,Pink Heart Shape Egg Frying Pan
35968,Folk Art Metal Heart T-Light Holder
35818B,Acrylic Jewel Icicle Blue
47016,Light Decoration Battery Operated
21349,Ivy Heart Wreath
84974,S/2 Zinc Heart Design Planters
22176,Blue Owl Soft Toy
72818,Christmas Decoupage Candle
21071,Vintage Billboard Drink Me Mug
22035,Vintage Caravan Greeting Card
23628,Set 10 Cards Triangle Icons 17220
23643,Set 10 Cards Christmas Bauble 16954
37491A,Yellow/Pink Ceramic Candle Holder
90001A,Antique Raspberry Flower Earrings
90185C,Black Diamante Expandable Ring
90209C,Pink Enamel+Glass Hair Comb
22848,Bread Bin Diner Style Pink
35912B,White/Pink Chick Decoration
22257,Felt Farm Animal Sheep
21801,Christmas Tree Decoration With Bell
35810A,Enamel Pink Coffee Container
84870C,Green Geisha Girl
16248B,Blue Hole Punch
85131A,Beaded Pearl Heart White On Stick
84818,Danish Rose Photo Frame
90162C,Ant Silver Fuschia Boudicca Ring
90162D,Ant Silver Purple Boudicca Ring
90124A,Pink Murano Twist Necklace
22925,Blue Giant Garden Thermometer
21163,Do Not Touch My Stuff Door Hanger
22244,3 Hook Hanger Magic Garden
21613,S/12 Vanilla Botanical T-Lights
85035B,Chocolate 3 Wick Morris Box Candle
22929,School Desk And Chair
47367B,Pair Padded Hangers Pink Check
90016A,Silver/Mop Pendant Orbit Necklace
90032,Ivory Shell Heart Necklace
90014B,Gold Mop Orbit Necklace
20702,Pink Padded Mobile
23072,Marie Antoinette Trinket Box Silver
23071,Marie Antoinette Trinket Box Gold
21294,Etched Glass Coaster
20967,Grey Floral Feltcraft Shoulder Bag
85035A,Gardenia 3 Wick Morris Boxed Candle
22569,Feltcraft Cushion Butterfly
22039,Botanical Lily Gift Wrap
21794,Classic French Style Basket Natural
21424,Woodland Storage Box Large
21157,Red Retrospot Washbag
21627,Elephant Carnival Pouffe
22103,Mirror Mosaic T-Light Holder Round
22857,Assorted Easter Gift Tags
20662,First Class Holiday Purse
84507C,Blue Circles Design Monkey Doll
21002,Rose Du Sud Drawstring Bag
85124C,Green Juicy Fruit Photo Frame
20903,Vintage Keepsake Box Travelogue
20898,Vintage Notebook Travelogue
45013,Folding Shoe Tidy
90142D,Mop Pendant Shell Necklace
22849,Bread Bin Diner Style Mint
90178A,Amber Chunky Glass+Bead Necklace
84452,Metal Rabbit Ladder Easter
85186C,Bunny Egg Garland
22049,Wrap Christmas Screen Print
21829,Dinosaur Keyrings Assorted
44092C,Purple/Copper Hanging Lampshade
21738,Cosy Slipper Shoes Small Red
84638,Small Kitchen Flower Pots Plaque
35645,Vintage Bead Pink Jewel Box
90025F,Baroque Butterfly Earrings Crystal
90001C,Antique Opal White Flower Earrings
90036E,"Flower Glass Garld Neckl36""Amethyst"
37476,Condiment Tray 4 Bowls And 4 Spoons
21476,Steel Sweetheart Round Table Cream
84921,Cream And Pink Flowers Pony
90129D,Amber Glass Tassle Bag Charm
90194,Silver Lariat Black Stone Earrings
35914,Pink Chick Egg Warmer + Egg Cup
37468,Hardman Mug 3 Assorted
21587,Cosy Hour Giant Tube Matches
35916A,Yellow Felt Hanging Heart W Flower
35916B,Blue Felt Hanging Heart With Flower
35916C,Pink Felt Hanging Heart W Flower
90043,Copper And Brass Bag Charm
72816,Set/3 Christmas Decoupage Candles
21664,Ridged Glass Storage Jar Cream Lid
40046A,Red Daisy Paper Lampshade
20984,12 Pencils Tall Tube Posy
20663,Queen Of The Skies Holiday Purse
23604,Set 10 Mini Santa & Snowman 17087
72140E,Best Dad Candle Letters
21448,12 Daisy Pegs In Wood Box
21634,Assorted Mini Madras Notebook
84247K,Folk Art Greeting Card Pack/12
22336,Dove Decoration Painted Zinc
22062,Ceramic Bowl With Love Heart Design
85116,Black Candelabra T-Light Holder
20998,Rose Du Sud Oven Glove
23066,Small Deco Jewellery Stand
85211,S/4 Groovy Cat Magnets
21364,Peace Small Wood Letters
21078,Set/20 Strawberry Paper Napkins
21658,Glass Beurre Dish
22656,Vintage Blue Kitchen Cabinet
90173,Pair Butterfly Hair Clips
