ProductNo,ProductName
22775,Purple Drawerknob Acrylic Edwardian
23148,Miniature Antique Rose Hook Ivory
22365,Doormat Respectable House
22473,Tv Dinner Tray Vintage Paisley
22893,Mini Cake Stand T-Light Holder
21926,Red/Cream Stripe Cushion Cover
22806,Set Of 6 T-Lights Wedding Cake
23459,Dolly Cabinet 2 Drawers
23458,Dolly Cabinet 3 Drawers
82483,Wood 2 Drawer Cabinet White Finish
22852,Dog Bowl Vintage Cream
72800C,4 Pink Dinner Candle Silver Flock
72800B,4 Purple Flock Dinner Candles
22673,French Garden Sign Blue Metal
23360,Set 8 Candles Vintage Doily
72811,Small Zinc/Glass Candleholder
23019,Small Apothecary Measuring Jar
23457,Large Parlour Picture Frame
23578,Snack Tray Red Gingham
21442,Green Birdhouse Decoration
21034,Rex Cash+Carry Jumbo Shopper
21524,Doormat Spotty Home Sweet Home
23415,Home Sweet Home Hook
22986,Wrap Gingham Rose
16156S,Wrap Pink Fairy Cakes
22045,Spaceboy Gift Wrap
84251G,Greeting Card Overcrowded Pool
21499,Blue Polkadot Wrap
22971,Queens Guard Coffee Mug
23558,Landmark Frame London Bridge
23553,Landmark Frame Camden Town
23557,Landmark Frame Baker Street
22668,Pink Baby Bunting
22276,Wash Bag Vintage Rose Paisley
85032A,Romantic Images Gift Wrap Set
85019A,Romantic Images Notebook Set
85019B,Blossom Images Notebook Set
22767,Triple Photo Frame Cornice
21164,Home Sweet Home Metal Sign
17012C,Origami Lavender Incense/Candl Set
23128,Feltcraft Boy Jean-Paul Kit
84707A,Silver Jewelled Mirror Trinket Tray
23253,16 Piece Cutlery Set Pantry Design
22847,Bread Bin Diner Style Ivory
21344,Moroccan Beaten Metal Dish
72783,Black Sil't Squ Candle Plate
72780,Black Silouette Candle Plate
22295,Heart Filigree Dove Large
22779,Wooden Owls Light Garland
22780,Light Garland Butterfiles Pink
22231,Jigsaw Tree With Birdhouse
22228,Bunny Wooden Painted With Bird
84012,Magic Sheep Wool Growing From Paper
23485,Botanical Gardens Wall Clock
23359,Set Of 12 T-Lights Vintage Doily
21756,Bath Building Block Word
37495,Fairy Cake Birthday Candle Set
85136C,Red Shark Helicopter
21055,Tool Box Soft Toy
48116,Doormat Multicolour Stripe
23250,Vintage Red Trim Enamel Bowl
23252,Vintage Red Enamel Trim Jug
22691,Doormat Welcome Sunrise
90214A,"Letter ""A"" Bling Key Ring"
90214C,"Letter ""C"" Bling Key Ring"
90214D,"Letter ""D"" Bling Key Ring"
90214E,"Letter ""E"" Bling Key Ring"
90214K,"Letter ""K"" Bling Key Ring"
90214L,"Letter ""L"" Bling Key Ring"
90214P,"Letter ""P"" Bling Key Ring"
90214S,"Letter ""S"" Bling Key Ring"
23374,Red Spot Paper Gift Bag
23337,Egg Frying Pan Mint
79160,Heart Shape Wireless Doorbell
23092,Large Antique White Photo Frame
22796,Photo Frame 3 Classic Hanging
22936,Baking Mould Rose White Chocolate
22932,Baking Mould Toffee Cup Chocolate
22931,Baking Mould Heart White Chocolate
22413,Metal Sign Take It Or Leave It
22511,Retrospot Babushka Doorstop
22510,Gingham Babushka Doorstop
23543,Wall Art Keep Calm
20686,Dolly Mixture Children's Umbrella
22389,Paperweight Save The Planet
22533,Magic Drawing Slate Bake A Cake
90214I,"Letter ""I"" Bling Key Ring"
85015,Set Of 12 Vintage Postcard Set
22096,Pink Paisley Square Tissue Box
21894,Potting Shed Seed Envelopes
21260,First Aid Tin
21136,Painted Metal Pears Assorted
22522,Childs Garden Fork Blue
85026B,Eau De Nile Jewelled T-Light Holder
22132,Red Love Heart Shape Cup
22097,Swallow Square Tissue Box
21439,Basket Of Toadstools
47469,Assorted Shapes Photo Clip Silver
22402,Magnets Pack Of 4 Vintage Collage
21446,12 Red Rose Peg Place Settings
79063C,Retro Pill Box Key Chain The King
21638,Assorted Tutti Frutti Notebook
21640,Assorted Tutti Frutti Fob Notebook
22938,Cupcake Lace Paper Set 6
22472,Tv Dinner Tray Dolly Girl
22343,Party Pizza Dish Red Retrospot
21530,Dairy Maid Toastrack
20868,Silver Fabric Mirror
22638,Set Of 4 Napkin Charms Crowns
21819,Glitter Christmas Star
21068,Vintage Billboard Love/Hate Mug
23223,Christmas Tree Hanging Silver
23222,Christmas Tree Hanging Gold
23267,Set Of 4 Santa Place Settings
23453,Oval Mini Portrait Frame
23486,Antique Heart Shelf Unit
48184,Doormat English Rose
23546,Wrap Paisley Park
23545,Wrap Red Vintage Doily
23231,Wrap Vintage Doily
23230,Wrap Alphabet Design
22688,Doormat Peace On Earth Blue
23416,Chambre Hook
22789,T-Light Holder Sweetheart Hanging
23147,Single Antique Rose Hook Ivory
23479,Wire Egg Basket
85061W,White Jewelled Heart Decoration
23107,White Hearts Wire Plant Pot Holder
23153,Zinc Sweetheart Wire Letter Rack
23108,Set Of 10 Led Dolly Lights
23454,Three Mini Hanging Frames
22822,Cream Wall Planter Heart Shaped
23291,Dolly Girl Childrens Cup
22098,Boudoir Square Tissue Box
22946,Wooden Advent Calendar Cream
23490,T-Light Holder Hanging Love Bird
21286,Retrospot Candle Large
22445,Pencil Case Life Is Beautiful
23697,A Pretty Thank You Card
90214R,"Letter ""R"" Bling Key Ring"
23487,Sweet Heart Cake Carrier
22084,Paper Chain Kit Empire
70007,Hi Tec Alpine Hand Warmer
22531,Magic Drawing Slate Circus Parade
22532,Magic Drawing Slate Leap Frog
22529,Magic Drawing Slate Go To The Fair
22453,Measuring Tape Babushka Blue
22434,Balloon Pump With 10 Balloons
46000S,Polyester Filler Pad 40x40cm
37448,Ceramic Cake Design Spotted Mug
22067,Choc Truffle Gold Trinket Pot
23155,Knickerbockerglory Magnet Assorted
23156,Set Of 5 Mini Grocery Magnets
20674,Green Polkadot Bowl
21415,Clam Shell Small
90089,Pink Crystal Skull Phone Charm
90214N,"Letter ""N"" Bling Key Ring"
21132,Silver Standing Gnome
84707B,Pink Jewelled Mirror Trinket Tray
22686,French Blue Metal Door Sign No
21903,Man Flu Metal Sign
22391,Paperweight Home Sweet Home
22410,Money Box Housekeeping Design
22405,Money Box Pocket Money Design
22395,Paperweight Vintage Paisley
22742,Make Your Own Playtime Card Kit
23522,Wall Art Dog And Ball
72819,Cupid Design Scented Candles
84509B,Set Of 4 Fairy Cake Placemats
22282,12 Egg House Painted Wood
22283,6 Egg House Painted Wood
23029,Drawer Knob Crackle Glaze Green
79302M,Art Lights Funk Monkey
90210B,Clear Acrylic Faceted Bangle
90057,Diamante Ring Assorted In Box
21742,Large Round Wicker Platter
71477,Coloured Glass Star T-Light Holder
23484,Heart Trellis Triple T-Light Holder
23608,Set 10 Cards Rudolphs Nose 17097
23654,Set 10 Card Snowman 16965
72127,Columbian Candle Round
72812,Large Zinc Glass Candleholder
82551,Laundry 15c Metal Sign
84859A,Silver Disco Handbag
84859B,Blue Disco Handbag
90038B,Glass And Painted Beads Bracelet Ol
90059C,Diamante Hair Grip Pack/2 Montana
90116,Fruit Salad Bag Charm
90119,Metalic Leaves Bag Charms
90177B,Drop Diamante Earrings Black Diamon
90202B,White Enamel Flower Hair Tie
20617,First Class Passport Cover
20654,First Class Luggage Tag
20780,Black Ear Muff Headphones
20829,Glitter Hanging Butterfly String
20837,French Floral Cushion Cover
21028,Ninja Rabbit Black
21070,Vintage Billboard Mug
21088,Set/6 Fruit Salad Paper Cups
21466,Red Flower Crochet Food Cover
21624,Vintage Union Jack Doorstop
22101,Mirror Mosaic Votive Holder
22250,Decoration Butterfly Magic Garden
22251,Birdhouse Decoration Magic Garden
22479,Daisy Garden Marker
22483,Red Gingham Teddy Bear
22583,Pack Of 6 Handbag Gift Boxes
22661,Charlotte Bag Dolly Girl Design
22678,French Blue Metal Door Sign 3
22685,French Blue Metal Door Sign 0
22968,Rose Cottage Keepsake Box
23006,Travel Card Wallet Flower Meadow
23035,Drawer Knob Ceramic Ivory
23048,Set Of 10 Lanterns Fairy Light Star
23096,Petit Tray Chic
23244,Round Storage Tin Vintage Leaf
23296,Set Of 6 Tea Time Baking Cases
23315,Ivory Refectory Clock
23523,Wall Art Treasure Ahoy
90087,Crystal Sea Horse Phone Charm
21535,Red Retrospot Small Milk Jug
22626,Black Kitchen Scales
23462,Rococo Wall Mirror White
85135C,Red Dragonfly Helicopter
22030,Swallows Greeting Card
22310,Ivory Knitted Mug Cosy
22350,Illustrated Cat Bowl
22366,Doormat Airmail
22344,Party Pizza Dish Pink Polkadot
22345,Party Pizza Dish Blue Polkadot
22346,Party Pizza Dish Green Polkadot
22431,Watering Can Blue Elephant
22432,Watering Can Pink Bunny
23542,Wall Art 70'S Alphabet
23135,Small Zinc Heart Wall Organiser
23330,Decorative Wicker Heart Medium
23597,Paper Bunting Paisley Park
22606,Wooden Skittles Garden Set
84600,New Baroque Jewellery Box
84976,Rectangular Shaped Mirror
85111,Silver Glitter Flower Votive Holder
72801C,4 Rose Pink Dinner Candles
20869,Gold Fabric Mirror
84429A,Medium Pink Buddha Head
23180,Mum's Kitchen Clock
21365,Mirrored Wall Art Stars
21371,Mirrored Wall Art Poppies
21629,Square Floor Cushion Vintage Red
20772,Garden Path Journal
47580,Tea Time Des Tea Cosy
23085,Antique Silver Bauble Lamp
22320,Birds Mobile Vintage Design
23131,Mistletoe Heart Wreath Cream
22990,Cotton Apron Pantry Design
22130,Party Cone Christmas Decoration
20616,Cherry Blossom Passport Cover
20615,Blue Polkadot Passport Cover
20652,Blue Polkadot Luggage Tag
23132,Small Ivory Heart Wall Organiser
21253,Set Of Picture Frame Stickers
79191C,Retro Plastic Elephant Tray
23020,Glass Songbird Storage Jar
21531,Red Retrospot Sugar Jam Bowl
51008,Afghan Slipper Sock Pair
46000M,Polyester Filler Pad 45x45cm
23114,Vintage Leaf Chopping Board
85127,Small Square Cut Glass Candlestick
23137,Zinc Wire Sweetheart Letter Tray
22797,Chest Of Drawers Gingham Heart
22635,Childs Breakfast Set Dolly Girl
23461,Sweetheart Bird House
85225,Bling Key Ring Stand
22269,Egg Cup Natural Chicken
23186,French Style Storage Jar Cafe
21469,Polka Dot Raffia Food Cover
21537,Red Retrospot Pudding Bowl
23104,Ivory Cafe Hanging Lamp
22937,Baking Mould Chocolate Cupcakes
20846,Zinc Heart Lattice T-Light Holder
22407,Money Box First Aid Design
85034C,3 Rose Morris Boxed Candles
84926D,La Palmiera Tile Coaster
79051A,Smokey Grey Colour Glass
84927F,Psychedelic Tile Hook
21463,Mirrored Disco Ball
21245,Green Polkadot Plate
22706,Wrap Cowboys
23031,Drawer Knob Crackle Glaze Pink
21165,Beware Of The Cat Metal Sign
21706,Folding Umbrella Red/White Polkadot
21948,Set Of 6 Cake Chopsticks
22499,Wooden Union Jack Bunting
22731,3d Christmas Stamps Stickers
22732,3d Vintage Christmas Stickers
23045,Paper Lantern 5 Point Star Moon
84884A,Ant White Wire Heart Spiral
23139,Single Wire Hook Pink Heart
22762,Cupboard 3 Drawer Ma Campagne
21196,Round White Confetti In Tube
21198,White Heart Confetti In Tube
21534,Dairy Maid Large Milk Jug
23058,Christmas Hanging Snowflake
22774,Red Drawer Knob Acrylic Edwardian
23026,Drawer Knob Vintage Glass Star
22782,Set 3 Wicker Storage Baskets
23691,Wrap Keep Calm Birthday
21745,Gaolers Keys Decorative Garden
16161P,Wrap English Rose
23090,Vintage Glass T-Light Holder
23078,Ice Cream Pen Lip Gloss
22403,Magnets Pack Of 4 Vintage Labels
22696,Wicker Wreath Large
23342,Mint Diner Wall Clock
22802,Faux Fur Chocolate Throw
21630,Floor Cushion Elephant Carnival
20761,Blue Paisley Sketchbook
21584,Retrospot Small Tube Matches
22079,Ribbon Reel Hearts Design
20755,Blue Paisley Pocket Book
23408,Photo Frame Linen And Lace Small
21090,Set/6 Collage Paper Plates
21084,Set/6 Collage Paper Cups
22333,Retrospot Party Bag + Sticker Set
47503H,Ass Floral Print Spirit Level
21204,Daisies Honeycomb Garland
16011,Animal Stickers
16216,Letter Shape Pencil Sharpener
72799C,Pink Pillar Candle Silver Flock
22436,12 Coloured Party Balloons
22334,Dinosaur Party Bag + Sticker Set
22082,Ribbon Reel Stripes Design
22660,Doormat I Love London
22773,Green Drawer Knob Acrylic Edwardian
21340,Classic Metal Birdcage Plant Holder
23491,Vintage Jingle Bells Heart
84826,Asstd Design 3d Paper Stickers
22266,Easter Decoration Hanging Bunny
22610,Pens Assorted Funny Face
84509E,Set Of 4 Carousel Placemats
84806A,Pink Candystuft Artificial Flower
85212,Mini Painted Garden Decoration
23154,Set Of 4 Jam Jar Magnets
23060,Heart Beaded Trellis Decoration
84711B,Pink Oval Shape Trinket Box
84708B,Pink Jewelled Photo Frame
22281,Easter Tree Yellow Birds
23442,12 Hanging Eggs Hand Painted
21455,Painted Yellow Wooden Daisy
23067,Hanging Engraved Metal Heart
23441,Hand Painted Hanging Easter Egg
22623,Box Of Vintage Jigsaw Blocks
21726,Multi Hearts Stickers
22400,Magnets Pack Of 4 Home Sweet Home
22435,Set Of 9 Heart Shaped Balloons
23502,Playing Cards Vintage Doily
90129C,Green Glass Tassle Bag Charm
90129B,Turquoise Glass Tassle Bag Charm
90129F,Red Glass Tassle Bag Charm
23249,Vintage Red Enamel Trim Plate
21504,Skulls Greeting Card
21700,Big Doughnut Fridge Magnets
22568,Feltcraft Cushion Owl
21679,Skulls Stickers
20759,Chrysanthemum Pocket Book
20758,Abstract Circles Pocket Book
72351B,Set/6 Pink Butterfly T-Lights
23472,Nine Drawer Office Tidy
21418,Starfish Soap Dish
21420,Oyster Trinket Box
21907,I'm On Holiday Metal Sign
23333,Ivory Wicker Heart Medium
85130B,Beaded Crystal Heart Green Large
85130D,Beaded Crystal Heart Pink Large
85130C,Beaded Crystal Heart Blue Large
22233,Jigsaw Rabbit And Birdhouse
22232,Jigsaw Toadstools 3 Piece
23099,French Carriage Lantern
21622,Vintage Union Jack Cushion Cover
22786,Cushion Cover Pink Union Jack
46000R,Polyester Filler Pad 45x30cm
20781,Gold Ear Muff Headphones
85062,Pearl Crystal Pumpkin T-Light Hldr
37449,Ceramic Cake Stand + Hanging Cakes
21456,2 Picture Book Eggs Easter Chicks
22967,Set 3 Song Bird Paper Eggs Assorted
22254,Felt Toadstool Large
22255,Felt Toadstool Small
23079,Toadstool Bedside Light
22981,Pantry Apple Corer
21366,Mirrored Wall Art Photo Frames
85204,Hanging Wood And Felt Flower
75049L,Large Circular Mirror Mobile
44235,Assorted Coloured Circle Mobile
21915,Red Harmonica In Box
21625,Vintage Union Jack Apron
22641,Set Of 4 Napkin Charms Instrument
90214F,"Letter ""F"" Bling Key Ring"
90214G,"Letter ""G"" Bling Key Ring"
21370,Mirrored Wall Art Foxy
21373,Mirrored Wall Art Snowflakes
21730,Glass Star Frosted T-Light Holder
22973,Children's Circus Parade Mug
23446,Blue Bunny Easter Egg Basket
23440,Paint Your Own Eggs In Crate
84805B,Blue Climbing Hydranga Art Flower
84804B,Blue Delphinium Artificial Flower
23447,Pink Bunny Easter Egg Basket
23473,Woodland Small Red Felt Heart
23475,Woodland Small Pink Felt Heart
23580,Snack Tray Happy Forest
84625A,Pink New Baroquecandlestick Candle
21265,Pink Goose Feather Tree 60cm
21128,Gold Fishing Gnome
21698,Mock Lobster Fridge Magnet
84880,White Wire Egg Holder
21818,Glitter Heart Decoration
90214H,"Letter ""H"" Bling Key Ring"
90081C,Lily Brooch Olive Colour
90082B,Diamante Bow Brooch Red Colour
90081A,Lily Brooch Amethyst Colour
90073,Vintage Enamel & Crystal Earrings
22305,Coffee Mug Pink Paisley Design
22718,Card Cat And Tree
84843,White Soap Rack With 2 Bottles
21883,Stars Gift Tape
21880,Red Retrospot Tape
22851,Set 20 Napkins Fairy Cakes Design
35001G,Hand Open Shape Gold
35004G,Set Of 3 Gold Flying Ducks
21707,Folding Umbrella Blackblue Polkadot
84661C,Pink Square Table Clock
21896,Potting Shed Twine
22100,Skulls Square Tissue Box
22939,Adult Apron Apple Delight
21063,Party Invites Jazz Hearts
22288,Hanging Metal Rabbit Decoration
21244,Blue Polkadot Plate
21317,Glass Sphere Candle Stand Medium
85104,Silver Glass T-Light Set
23547,Wrap Flower Shop
84813,Set Of 4 Diamond Napkin Rings
22448,Pin Cushion Babushka Red
22799,Sweetheart Wire Fruit Bowl
84679,Classical Rose Table Lamp
84806B,White Candystuft Artificial Flower
84804A,Cream Delphinium Artificial Flower
84805A,Cream Climbing Hydranga Art Flower
22408,Money Box Confectionery Design
90195A,Purple Gemstone Bracelet
22042,Christmas Card Singing Angel
21788,Kids Rain Mac Blue
21666,Ridged Glass T-Light Holder
23036,T-Light Holder Silver Petit Four
23021,Glass Bonne Jam Jar
22710,Wrap I Love London
22409,Money Box Biscuits Design
23481,Pearlised Ivory Heart Small
23068,Aluminium Stamped Heart
90093,Clear Crystal Star Phone Charm
22306,Silver Mug Bone China Tree Of Life
21381,Mini Wooden Happy Birthday Garland
84051,Ass Colour Glowing Tiaras
84199,Glow In Dark Dolphins
85136A,Yellow Shark Helicopter
22440,Balloon Water Bomb Pack Of 35
90099,Necklace+Bracelet Set Blue Hibiscus
23305,Set 4 Picnic Cutlery Blueberry
23304,Set 4 Picnic Cutlery Cherry
22512,Doorstop Racing Car Design
84926E,Flowers Tile Coaster
84510E,Set Of 4 Green Carousel Coasters
23544,Wall Art Mid Century Modern
79149B,Silicon Star Bulb Blue
85071D,Charlie+Lola My Room Door Sign
85071A,Blue Charlie+Lola Personal Doorsign
22038,Botanical Lavender Gift Wrap
21621,Vintage Union Jack Bunting
20763,Daisy Sketchbook
22705,Wrap Green Pears
22863,Soap Dish Brocante
20705,Mrs Robot Soft Toy
21579,Lolita Design Cotton Tote Bag
20767,Blue Paisley Journal
15030,Fan Black Frame
20867,Pink Rose Fabric Mirror
21263,Green Goose Feather Tree 60cm
23121,Pack Of 6 Cocktail Parasol Straws
21261,Green Goose Feather Christmas Tree
23169,Classic Glass Cookie Jar
21287,Scented Velvet Lounge Candle
84658,White Stitched Cushion Cover
23540,Wall Art The Magic Forest
79157B,Ubo-Light Triobase Blue
23016,Glass Twist Bon Bon Jar
21713,Citronella Candle Flowerpot
85014A,Black/Blue Polkadot Umbrella
21693,Small Hammered Silver Candlepot
21689,Silver Vanilla Flower Candle Pot
23136,Ivory Wire Sweetheart Letter Tray
21850,Blue Diamante Pen In Gift Box
22359,Glass Jar Kings Choice
20771,Chrysanthemum Journal
20762,Green Fern Sketchbook
21264,White Goose Feather Tree 60cm
21039,Red Retrospot Shopping Bag
22262,Felt Egg Cosy Chicken
21428,Set3 Book Box Green Gingham Flower
22517,Childs Garden Rake Pink
22515,Childs Garden Spade Pink
84086B,Yellow/Blue Retro Radio
23406,Home Sweet Home Key Holder
23185,French Style Storage Jar Jam
21086,Set/6 Red Spotty Paper Cups
21925,Union Stripe Cushion Cover
22214,Candle Plate Lace White
22452,Measuring Tape Babushka Pink
23117,Poppy Fields Chopping Board
20735,Black Mini Tape Measure
75178,Asstd Col Butterfly/Crystal W/Chime
23217,Laurel Heart Antique Silver
15044C,Purple Paper Parasol
21988,Pack Of 6 Skull Paper Plates
22316,200 Bendy Skull Straws
21131,Gold Standing Gnome
82613A,Metal Sign Cupcake Single Hook
37446,Mini Cake Stand With Hanging Cakes
21844,Red Retrospot Mug
20769,Daisy Journal
23432,Pretty Hanging Quilted Hearts
23482,Pearlised Ivory Heart Large
21292,Small Stripes Chocolate Gift Bag
22682,French Blue Metal Door Sign 7
85230B,Cinnamon Scented Votive Candle
20768,Green Fern Journal
84212,"Assorted Flower Colour ""Leis"""
20618,Queen Of The Skies Passport Cover
22093,Motoring Tissue Box
22066,Love Heart Trinket Pot
84536B,Fairy Cakes Notebook A7 Size
84875B,Green Square Compact Mirror
84915,Hand Towel Pink Flower And Daisy
84952B,Black Love Bird T-Light Holder
84969,Box Of 6 Assorted Colour Teaspoons
85172,Hyacinth Bulb T-Light Candles
90037B,Tiny Crystal Bracelet Green
90037C,Tiny Crystal Bracelet Blue
90039D,Fire Polished Glass Bracelet Green
90056,Chunky Cracked Glaze Necklace Ivory
90160A,Purple Boudicca Large Bracelet
90180B,Purple Amethyst Necklace W Tassel
90182A,Amber 3 Bead Drop Earrings
90197B,Black Glass Bracelet W Heart Charms
90214J,"Letter ""J"" Bling Key Ring"
90214O,"Letter ""O"" Bling Key Ring"
11001,Asstd Design Racing Car Pen
20794,Blue Tile Hook
21025,Space Frog
21107,Cream Slice Flannel Pink Spot
21555,Ceramic Strawberry Trinket Tray
22223,Cake Plate Lovebird Pink
22354,Retrospot Padded Seat Cushion
22541,Mini Jigsaw Leap Frog
22949,Set Of 36 Dolly Girl Paper Doilies
23070,Edwardian Heart Photo Frame
23517,Embroidered Ribbon Reel Rebecca
23541,Wall Art Classic Puddings
23615,Set 10 Cards Printed Graphic 17219
23634,Set 10 Cards Xmas Choir 17068
47590A,Blue Happy Birthday Bunting
23373,Vintage Christmas Paper Gift Bag
85107,Cut Glass T-Light Holder Octagon
62018,Sombrero
22311,Office Mug Warmer Black+Silver
21425,Skulls Storage Box Large
21427,Skulls Storage Box Small
90214Y,"Letter ""Y"" Bling Key Ring"
22117,Metal Sign Her Dinner Is Served
48188,Doormat Welcome Puppies
85180B,Pink Hearts Light Chain
20956,Porcelain T-Light Holders Assorted
84926F,Psychedelic Tile Coaster
22128,Party Cones Candy Assorted
90058B,Crystal Stud Earrings Assorted Col
90058A,Crystal Stud Earrings Clear Display
22842,Biscuit Tin Vintage Red
23043,Paper Lantern 9 Point Holly Star L
22913,Red Coat Rack Paris Fashion
22047,Empire Gift Wrap
22089,Paper Bunting Vintage Paisley
21500,Pink Polkadot Wrap
22332,Skulls Party Bag + Sticker Set
23039,T-Light Holder Silver Heart Handle
22911,Paper Chain Kit London
84827,Ass Des Phone Sponge Craft Sticker
23492,Vintage Jingle Bells Wreath
23303,Set 4 Picnic Cutlery Fondant
46775D,Sunset Colour Chunky Knitted Throw
21367,Mirrored Wall Art Gents
21368,Mirrored Wall Art Ladies
21369,Mirrored Wall Art Splodges
21426,Woodland Storage Box Small
21578,Woodland Design Cotton Tote Bag
21888,Bingo Set
22883,Number Tile Vintage Font 4
22889,Number Tile Vintage Font No
23042,Paper Lantern 7 Point Snow Star
23157,Set Of 6 Nativity Magnets
84509C,Set Of 4 Polkadot Placemats
84510C,Set Of 4 Polkadot Coasters
22927,Green Giant Garden Thermometer
22267,Easter Decoration Egg Bunny
21306,Set/4 Daisy Mirror Magnets
23282,Folding Butterfly Mirror Ivory
22152,Place Setting White Star
85023B,Eau De Nile Jewelled Photoframe
22649,Strawberry Fairy Cake Teapot
22843,Biscuit Tin Vintage Green
21112,Swiss Roll Towel Pink Spots
21821,Glitter Star Garland With Bells
21868,Potting Shed Tea Mug
21270,Antique Cream Cutlery Cupboard
23409,Photo Frame Linen And Lace Large
23470,Card Holder Love Bird Large
16045,Popart Wooden Pencils Asst
23226,Filigree Heart Daisy White
22537,Magic Drawing Slate Dinosaur
22933,Baking Mould Easter Egg Milk Choc
84859C,Pink Disco Handbag
22229,Bunny Wooden Painted With Flower
17084R,Assorted Incense Pack
84406B,Cream Cupid Hearts Coat Hanger
23460,Sweetheart Wall Tidy
22538,Mini Jigsaw Go To The Fair
37413,Icon Mug Revolutionary
37489D,Pink/Green Flower Design Big Mug
17021,Namaste Swagat Incense
85020,Round Pink Heart Mirror
23146,Triple Hook Antique Ivory Rose
21820,Glitter Heart Garland With Bells
23023,Ridged Bonne Jam Jar T-Light Holder
35818P,Acrylic Jewel Icicle Pink
84360,Table Lamp White Shade Wood Base
22810,Set Of 6 T-Lights Snowmen
21694,Small Regal Silver Candlepot
22497,Set Of 2 Tins Vintage Bathroom
21636,Madras Notebook Medium
23513,Embroidered Ribbon Reel Susie
23116,Vegetable Garden Chopping Board
84987,Set Of 36 Teatime Paper Doilies
22882,Number Tile Vintage Font 3
22887,Number Tile Vintage Font 8
84989A,75 Green Fairy Cake Cases
23022,Small Bonne Jam Jar T-Light Holder
16012,Food/Drink Sponge Stickers
85183A,Charlie & Lola Wastepaper Bin Blue
22284,Hen House Decoration
22285,Hanging Hen On Nest Decoration
23150,Ivory Sweetheart Soap Dish
90214M,"Letter ""M"" Bling Key Ring"
90214B,"Letter ""B"" Bling Key Ring"
90214T,"Letter ""T"" Bling Key Ring"
90214U,"Letter ""U"" Bling Key Ring"
90214V,"Letter ""V"" Bling Key Ring"
90214W,"Letter ""W"" Bling Key Ring"
90214Z,"Letter ""Z"" Bling Key Ring"
22050,Pink Paisley Rose Gift Wrap
22048,Birthday Banquet Gift Wrap
17107D,Flower Fairy 5 Drawer Liners
85203,Hanging Wood And Felt Butterfly
22575,Metal Merry Christmas Wreath
22349,Dog Bowl Chasing Ball Design
15044A,Pink Paper Parasol
15044D,Red Paper Parasol
22812,Pack 3 Boxes Christmas Panettone
22504,Cabin Bag Vintage Retrospot
84609,Tall Rococo Candle Holder
21683,Medium Medina Stamped Metal Bowl
23520,Embroidered Ribbon Reel Ruby
23516,Embroidered Ribbon Reel Sophie
23327,Hanging Clear Mini Bottle
23046,Paper Lantern 9 Point Deluxe Star
21723,Alphabet Hearts Sticker Sheet
23539,Wall Art Loves' Secret
20653,Cherry Blossom Luggage Tag
20707,Crazy Daisy Heart Decoration
20765,Chrysanthemum Sketchbook
21116,Owl Doorstop
21147,Jingle Bells Tree Decoration
21293,Mirrored Dove Wall Decoration
22559,Seaside Flying Disc
22681,French Blue Metal Door Sign 6
23038,T-Light Holder Silver Saucer
23129,Heart Shaped Holly Wreath
47567B,Tea Time Kitchen Apron
84569A,Pack 3 Iron On Dog Patches
84673B,Blue Fly Swat
84951A,Set Of 4 Pistachio Lovebird Coaster
85095,Three Canvas Luggage Tags
85129B,Beaded Crystal Heart Green Small
85129D,Beaded Crystal Heart Pink Small
85180A,Red Hearts Light Chain
21060,Party Invites Balloon Girl
21207,Skull And Crossbones Garland
21676,Flowers Stickers
21719,Lovely Bonbon Sticker Sheet
21851,Lilac Diamante Pen In Gift Box
22248,Decoration Pink Chick Magic Garden
23306,Set Of 36 Pantry Paper Doilies
35971,Rose Folkart Heart Decorations
84912B,Green Rose Washbag
85163B,Black Baroque Wall Clock
90019A,Silver Mop Orbit Bracelet
90024B,New Baroque B'fly Necklace Red
90039A,Fire Polished Glass Bracelet Red
90059B,Diamante Hair Grip Pack/2 Black Dia
90071,Ruby Glass Cluster Earrings
90118,Pink Daisy Bag Charm
90163B,White Rosebud & Pearl Necklace
90164B,White Rosebud Pearl Bracelet
90179B,Purple Fine Bead Necklace W Tassel
90183B,Amethyst Drop Earrings W Long Beads
90184B,Amethyst Chunky Bead Bracelet W Str
17129F,Blue Glass Gems In Bag
20619,Tropical Passport Cover
20622,Vip Passport Cover
20775,Daisy Notebook
20795,Large Blue Provencal Ceramic Ball
20835,French Lattice Cushion Cover
21520,Booze & Women Greeting Card
21708,Folding Umbrella Cream Polkadot
22120,Welcome Wooden Block Letters
22318,Five Heart Hanging Decoration
23138,Single Wire Hook Ivory Heart
23324,Rustic Strawberry Jam Pot Large
37462E,Pet Mug Goldfish
84931B,Blue Scottie Dog W Flower Pattern
90103,Purple Frangipani Necklace
90211A,Diamond Las Vegas Necklace 45cm
20699,Mousey Long Legs Soft Toy
84674,Flying Pig Watering Can
90094,Necklace+Bracelet Set Fruit Salad
85096,Hilda Candy Spot Rabbit
20802,Small Glass Sundae Dish Clear
21376,Large Tall Camphor Wood Toadstool
21375,Large Camphor Wood Field Mushroom
17191A,Rose Flower Candle+Incense 16x16cm
35599D,Pink And White Christmas Tree 120cm
21884,Cakes And Bows Gift Tape
23102,Silver Hearts Table Decoration
22416,Set Of 36 Spaceboy Paper Doilies
22148,Easter Craft 4 Chicks
22770,Mirror Cornice
23010,Circus Parade Baby Gift Set
20893,Hanging Bauble T-Light Holder Small
35598D,Pink/White Christmas Tree 60cm
35599B,Black Christmas Tree 120cm
46000U,Polyester Filler Pad 30cmx30cm
84711A,Silver Oval Shape Trinket Box
90198B,Vintage Rose Bead Bracelet Black
90040C,Murano Style Glass Bracelet Gold
21937,Strawberry Picnic Bag
85194S,Hanging Spring Flower Egg Small
21386,Ivory Hanging Decoration Egg
